jobUrl,jobName,jobSalary,jobLocation,jobExperience,jobDegree,jobType,jobDetail,jobCompanyName
https://www.lagou.com/jobs/7029893.html?show=708057c0091841d9be248dcb5fa17771,fpga工程师(J10057),18k-35k,/深圳/,经验1-3年/,本科及以上/,全职,"职位诱惑：有广阔的发展空间，极强的战斗团队职位描述：工作职责:1.负责低延迟FPGA应用开发的各流程（设计、文档、开发、测试）2.负责异构计算加速器的调研及竞争力分析工作任职资格:1.3年以上经验，统招本科及以上学历，计算机专业、电子、软件工程、通信、电气自动化等相关专业；2.精通FPGA开发实现流程，熟练掌握Verilog/VHDL,SystemVerilog和UVM;3.熟悉高性能网络协议栈(PCS/MAC/IP/UDP/TCP/IGMP等)的硬件加速,具有丰富的PCIe,DDRx等高速接口设计经验；4.熟悉Linux开发环境,以及Shell脚本Bash/Python/Tcl/Perl;5.良好的学习能力和协作精神.负责任,愿意接受挑战并在压力下工作；6.良好的英文阅读能力；7.加分项-参与过大型高吞吐量,低延迟FPGA/ASIC项目开发,网络互联领域优先;-熟悉基于C/C++的HLS/OpenCL并行异构计算开发;-熟悉RDMA高性能网络及Solarflare,Mellanox等智能网卡者优先;-具有金融高频/低延迟交易系统设计经验者优先;-英文写作和听说能力为加分项;工作地址深圳-福田区-车公庙-天安数码城天经大厦AB座A603-606查看地图职位发布者:华小锐招聘经理",华锐金融技术
https://www.lagou.com/jobs/7030091.html?show=8b16dd5f4c384a239b39aa40dd0801ef,cocos2d-x,6k-10k,/成都/,经验1-3年/,本科及以上/,全职,职位诱惑：技术大牛，技能提升，项目分红职位描述：工作内容:1、负责游戏开发工作任职资格:110通信、电子工程、自动化、计算机及其相关专业，统招本科及以上学历。210至少有1年以上Cocos2d-x开发经验，有过手机网游的开发工作。3、有良好的C/C++基础，熟悉Lua脚本编程或者Phyton脚本；4、具有Cocos2d-x游戏开发经验，熟悉Cocos2d-x框架实现原理；5、熟悉图形学原理、对纹理格式、渲染流程、性能优化有深入研究；6、熟悉常用数据结构和算法且能熟练运用；7、良好的数学和计算机图形基础，熟悉OpenGLES；8、良好的沟通和学习能力，能承受工作压力，有独立开发能力，有团队合作精神；9、具备良好的编程习惯和代码规范；工作地址成都-高新区-天府三街腾讯成都大厦B楼912查看地图职位发布者:漩shineHR,玉米树科技
https://www.lagou.com/jobs/7030457.html?show=96a417ed960f47d79146550f036e172b,高级web安全工程师,20k-35k,/杭州/,经验3-5年/,本科及以上/,全职,职位诱惑：SDL、渗透测试职位描述：岗位职责:1、配合推进SDL体系建设（如：上线前安全检查、自动化漏洞扫描、完善上线流程等）；2、负责对新旧业务系统进行渗透测试（包括IDC或办公网）。技术要求：1、3年以上渗透测试经验，能独立完成渗透测试工作；2、熟悉SDL体系建设，有实战经验，能将SDL融入DevOps等；3、熟悉主流渗透测试和扫描工具，如IBMAppScan/HPInspect/Nessus/Awvs等；4、熟悉常见黑客攻击手法、原理、防护、绕过方法，包括但不限于：sql注入/跨站/文件包含/命令执行等；5、熟悉PHP/Java/C#/Python/Go中任意一种语言，能独立开发安全软件。工作地址杭州-滨江区-开发区-南环路3738号税友大厦查看地图职位发布者:胡奇虹招聘BP,税友软件
https://www.lagou.com/jobs/7033505.html?show=8996546c01ad43ea99b13293b66970ce,java架构师,20k-25k,/苏州/,经验3-5年/,本科及以上/,全职,"职位诱惑：福利好，待遇优，办公环境优美职位描述：岗位职责1、负责公司核心产品的前后端开发，优化，维护；2、负责核心技术问题的攻关，模块架构设计，系统优化，协助解决项目开发过程中的技术难题；3、了解互联网的技术发展、评估外部技术与解决方案；4、根据产品需求，按时完成指定模块的设计和开发；5、解决服务、产品建设中遇到的问题，并做到持续的技术改进和优化；任职要求：1、3年以上JAVA及Web应用开发经验；2、熟悉Spring,SpringMVC,SpringBoot,JPA等开源框架；3、熟悉网络编程，具有设计和开发对外API接口经验和能力；4.熟悉主流技术栈，如spring，mysql，redis，rocketMQ，zookeeper，mongodb等；5.能熟练使用常见分布式项目框架，如SpringCloud、dubbo等；6.熟悉分布式系统的设计和应用，熟悉分布式、缓存、消息、负载均衡等机制和实现；7.对数据库的基本理论和内部实现机制有深刻的理解，能够熟练应用MySQL、NoSQL；工作地址苏州-工业园区-湖东-巨中银座19楼查看地图职位发布者:付洁人事主管",中地行
https://www.lagou.com/jobs/7036116.html?show=b32a640f204a406c9d849a02280ade40,11314M-资深自动化/测试开发工程师,15k-30k,/深圳/,经验3-5年/,本科及以上/,全职,"职位诱惑：五险一金职位描述：工作职责1负责前后台系统的功能测试、性能测试、压力测试、算法效果分析等。确保测试质量，线上无重大BUG。2独立设计测试方案、测试用例，执行测试并撰写测试报告，进行自动化测试，包括相关工具及脚本设计实现。3期望可以从工具、流程角度，持续提高测试质量，降低测试成本。任职要求1计算机相关专业，统招本科及以上学历；25年以上软件开发、测试开发工作经验；有开发能力者优先；3精通研发流程和测试用例设计,熟练掌握单元测试，接口测试，持续集成，压力测试等测试方法；能够进行自动化测试，包括相关工具及脚本设计实现；4有强烈的责任心和团队精神，善于沟通和合作；有较好的项目管控和推动能力；5熟悉常用Linux命令，能够分析和定位Bug的根因；6有测试框架编写、测试工具优化者优先；工作地址深圳-南山区-科技南十二路20号平安科技大厦（靠近高新园地铁站D出口）查看地图职位发布者:平安科技HR职位发布者",平安科技
https://www.lagou.com/jobs/7048081.html?show=b32a640f204a406c9d849a02280ade40,自动化测试工程师,13k-26k,/北京/,经验3-5年/,本科及以上/,全职,"职位诱惑：APUS独角兽六险一金租房补贴职位描述：岗位描述：1)负责客户端功能及接口的自动化测试工作；2)开发自动化测试工具包括命令行、页面、接口等工具；职位要求：1-4为必备条件1)精通java编程语言，熟悉Maven构建工具及Jenkins持续构建工具；2)熟悉http请求原理及协议，用过postman,fiddler等接口请求工具；3)熟悉linux和mysql，熟悉基本linux命令，能够编写基本的查询语句；4)具有接口自动化测试经验或客户端自动化测试经验（Android,IOS）；5)使用过Selenium,Appium等前端自动化测试工具；6)使用过jmeter,loadrunner等接口/性能测试工具。工作地址北京-朝阳区-望京-望京SOHO中心T3B座42层查看地图职位发布者:慕菁菁HR",APUSGroup
https://www.lagou.com/jobs/7048258.html?show=61de0e614aa64d2bacc5f301e5533071,SW-单片机嵌入式工程师,20k-35k,/深圳/,经验3-5年/,学历不限/,全职,职位诱惑：晋升空间、薪酬福利、发展平台职位描述：岗位职责：1、负责机器人驱动系统方案设计，并根据驱动系统方案设计完成驱动设备与相关传感器的调研、选型与测试；2、负责机器人动力学、运动学模型建立与运动控制算法研究；3、负责自动化生产类的单片机工装的开发设计、配合上位机完成调试和测试（控制系统、电子产品各类电信号采集和功能检测）；4、根据运动控制算法开发相应软件模块；5、配合结构工程师、电气工程师完成机器人集成调试；任职要求：1、全日制本科及以上学历，3-5年机器人系统或者生产线自动化系统规划设计及解决方案管理经验；2、精通STM32、EFM32等系列单片机架构及各种外设的操作，精通C/C++语言编程；3、熟练使用IGE、EPLAN等电气设计软件，熟练掌握至少一种品牌的PLC编程和使用或工业控制板嵌入式软硬件开发；4、熟悉同MES系统对接，生产自动化软硬件对接（机器人，PLC，传感器，视觉等）；5、有较强的沟通能力和解决问题能力，喜欢钻研，思路清晰敏捷，工作积极主动，有良好的团队协作精神和责任；6、抗压能力强，能适应不定期出差。工作地址深圳-南山区-大冲-深投控创智天地大厦（科技南一路与高新二道交叉口东北150米）查看地图职位发布者:Eva招聘经理,顺丰科技有限公司
https://www.lagou.com/jobs/7048281.html?show=2c81fd75bd8b4744b90ac98210fc6826,主编/副主编,10k-20k,/武汉/,经验5-10年/,本科及以上/,全职,"职位诱惑：美妆护肤品行业职位描述：1、负责美丽修行内容生态（图文或视频）及专业知识内容建设与发展，根据公司战略制定业务目标和运营策略，打造美丽修行高质量内容生态精准流量池。2、洞察用户群体特点，挖掘用户对资讯内容和专业知识的诉求，不断优化内容生产策略，提高全站高价值内容占比。3、负责平台整体内容团队的搭建及管理,审核编辑内容，把握及引导编辑思路，帮助打磨内容，给出指导意见，带领团队完成既定目标；4、搭建美丽修行知识图谱，打造最具价值的结构化专业内容，为用户提供可靠的专业知识内容5、对内容阅读数据进行实时监测与效果评估，根据内容的整体规划，制定和把握行业热点及动态，引导和拉升用户的阅读量与转发率，提高用户活跃度和留存率；6、进行深度原创编辑，并结合热点话题，通过内容策划等手段，进行多维度整合与输出；任职要求：1、统招本科以上学历，中文、新闻、医学、化工等专业优先；有时尚、医美等行业背景优先2、具有五年以上内容平台工作经验，有二十人及以上团队管理经验；3、有较强的图文或视频功底，对美业有深入研究，能够准确把握用户心态，能撰写出符合用户需求的内容；4、具有较强的策划能力、沟通能力和执行力，高度敬业及团队合作精神，抗压能力好；美感网感工作地址武汉-东湖新技术开发区-武汉光谷企业天地查看地图职位发布者:史峰HRM",美丽修行
https://www.lagou.com/jobs/7061675.html?show=8996546c01ad43ea99b13293b66970ce,架构师,30k-50k,/重庆/,经验10年以上/,本科及以上/,全职,职位诱惑：非996/优厚薪资待遇/各种福利齐备职位描述：岗位职责：1，负责公司产品的系统架构，以及各板块相关产品的设计方案；2、参与项目需求分析，搭建开发平台及环境；3、负责关键模块的实现，编写核心代码，解决团队成员开发过程中遇到的问题；4、不断对系统进行优化，分析和预估系统未来的瓶颈，制定合理解决方案；5、指导与日常培训，带领团队提高工作效率。任职要求：1、本科及以上学历，具备5及以上互联网产品的架构经验。2、有系统架构经验，独立主导过重大产品架构演化及推进落地。3、对技术和业务有前瞻性的思考，能够主导平台架构做方向性的决策并推进落地。4、具有强的自我驱动能和高效学习、把控新技术的能。5、协同能，具备良好的团队沟通协同能，能推动多业务、角色的大型项目顺推进，结果导向带领团队拿到结果。6、敬业精神及抗压能，有ownership，有很强的抗压能和心，能在关键时刻找到突破点。7、有工作流引擎、规则引擎、大数据架构经验优先。8、了解EA企业架构框架且有相关实际经验者优先。工作地址重庆-渝北区-大竹林-互联网产业园2期查看地图职位发布者:李树旺HRBP,力意智能科技
https://www.lagou.com/jobs/7073765.html?show=459a4438e2ca415eb0961fae7980b861,嵌入式软件工程师,20k-40k,/北京/,经验不限/,本科及以上/,全职,"职位诱惑：公司固定12薪+3-6个月年终奖；职位描述：主要职责在嵌入式处理器(ARMCortex-M,ARMCortex-A)环境下开发软件、算法、系统和应用；学历211起；其他项1.精通C/C++,Python或assemblylanguage2.熟悉CPU体系结构(RISC-V,X86,etc)，了解流水线结构，内存管理，指令集3.有嵌入式软件、系统的开发经验工作地址北京-朝阳区-东三环北路乙2号海南航空大厦B栋19F查看地图职位发布者:abbyHR",联盟智能社区
https://www.lagou.com/jobs/7080715.html?show=708057c0091841d9be248dcb5fa17771,FPGA工程师,15k-30k,/武汉/,经验3-5年/,本科及以上/,全职,职位诱惑：五险一金职位描述：工作职责1、负责核心模块及功能FPGA代码编写，仿真与调试；负责FPGA系统工程搭建与开发；2、配合硬件工程师完成新硬件平台的开发，调试；3、负责基于FPGA的视频图像算法开发与调试；4、负责Pcie/高速Transceiver等高速传输接口开发与维护；5、负责GigE/CameraLink接口图像采集卡FPGA程序开发与维护；6、与软件工程师配合系统功能调试。任职资格1、本科及以上学历，电子/通信/计算机等相关专业；2、本科5年以上，研究生3年以上相关工作经验；3、具备较扎实的数字电路基础；4、熟悉DDR/LVDS高速接口标准及相关协议；5、具备较强的分析处理问题能力，能够独立承担开发一些基本功能单元或产品；6、熟悉Altera/Xilinx等公司相关器件结构；7、熟练使用EDA开发工具；8、熟练掌握MicroBlaze软核功能开发与调试；9、熟练使用Verilog/VHDL等硬件描述语言；熟练使用C/C++等编程语言；10、具备良好的编程习惯及良好的文档管理习惯；有较好的团队配合意识；11、熟悉基本图像处理算法；12、有Xilinx7系列FPGA开发经验为佳；熟悉XilinxZynq7000系列架构，有实际开发经验为佳；13、能够熟练阅读英文技术资料并进行设计文档编写。工作地址武汉-洪山区-鲁巷-东湖新技术开发区查看地图职位发布者:赵露瑶人事,京诚顺达汽车租赁
https://www.lagou.com/jobs/7082877.html?show=96a417ed960f47d79146550f036e172b,Web安全研究,20k-35k,/杭州/,经验3-5年/,本科及以上/,全职,职位诱惑：五险一金带薪年假国内外旅游职位描述：职责职责：1、负责Web安全漏洞研究，跟踪国内外安全领域的安全动态并落地;2、参与攻击队项目，主要负责Web方向打点;3、定期团队技术分享，提升团队整体作战能力。任职要求：1、至少掌握JAVA/.NET/PHP/C等两种语言，可完成相关Exp编写；2、精通Web漏洞形成原理，具备代码审计能力；3、良好的逻辑思维能力和团队合作精神，善于交流和表达。加分项：1、具备良好的英语文档阅读能力；2、曾参加过技术沙龙担任嘉宾进行技术分享；3、具有CISSP、CISA、CSSLP、ISO27001、ITIL、PMP、COBIT、Security+、CISP、OSCP等安全相关资质者；4、具有大型SRC漏洞提交经验、获得年度表彰、大型CTF夺得名次者；5、开发过安全相关的开源项目；6、具备良好的人际沟通、协调能力、分析和解决问题的能力者优先；7、个人技术博客；8、在优质社区投稿过文章。工作地址杭州-滨江区-西兴-联慧街188号安恒大厦查看地图职位发布者:唐小姐招聘主管,安恒信息
https://www.lagou.com/jobs/7084123.html?show=b32a640f204a406c9d849a02280ade40,自动化测试工程师,6k-12k,/成都/,经验1-3年/,本科及以上/,全职,职位诱惑：蓝海行业上市公司股权激励项目奖金职位描述：岗位职责：1、分析测试需求，根据需求设计测试方法和测试场景；2、根据需求编写测试工具、自动化测试脚本；3、执行测试工具、测试数据制作、测试脚本，协助研发和其他测试人员对自动化测试脚本调优；4、保障软件质量，编写测试总结及其他需输出文档；5、总结测试经验、改进测试方法；6、协调测试团队内部工作以及与开发团队之间的工作。任职要求：1、计算机相关专业本科及以上学历，4年以上工作经验，包含至少2年以上的自动化测试经验；2、对Windows、Linux等大型主流操作系统的使用非常熟悉，对于Linux系统指令熟悉；3、熟练掌握C++、C#、Python等平台的一种或者多种语言，具备应用开发的能力和脚本编写能力；4、熟练使用SQL语言，熟练掌握SQLServer、MySQL等一种或多种数据库的使用；5、了解软件质量分析技术，包括对软件的分析和度量的各种技术，包括编写软件质量报告和软件分析报告；6、熟悉软件开发过程，掌握至少一种基于Python的自动化测试框架；7、精通接口自动化、UI自动化的开发；8、有Jenkins等持续集成的经验优先。工作地址成都-武侯区-武兴五路139号佳发科技大厦3栋9楼人事部查看地图职位发布者:佳发安泰教育职位发布者,成都佳发
https://www.lagou.com/jobs/7104062.html?show=734d59b1806446f5bf52e8c9493fe8a5,android开发工程师,15k-20k,/北京/,经验3-5年/,本科及以上/,全职,职位诱惑：五险一金、交通补、餐补、全勤职位描述：岗位职责：1.参与Android软件的需求调研和需求分析，撰写部分技术文档；2.负责软件的架构设计，完成Android开发环境和框架的搭建；3.负责Android手机软件的开发、测试和维护；4.负责解决开发过程中的Android技术问题。任职要求：1.计算机或相关专业本科及以上学历，3年以上Android平台实际开发经验；2.具备扎实的Java语言基础，能熟练使用AndroidSDK；3.熟悉Android应用开发框架，能熟练进行AndroidUI/Framework开发；4.熟悉Android下网络通信机制，对Socket通信、TCP/IP、HTTP有一定理解和经验；5.熟练掌握Android下XML和JSON操作，多线程操作；6.至少熟悉一种关系型数据库，如MySql、Oracle、SqlServer；7.拥有良好的代码习惯，结构清晰，命名规范，逻辑性强。工作地址北京-西城区-鼓楼西大街41号1号楼3层查看地图职位发布者:陶陶小姐职位发布者,动信通科技
https://www.lagou.com/jobs/7105172.html?show=708057c0091841d9be248dcb5fa17771,fpga逻辑,10k-15k,/成都/,经验3-5年/,本科及以上/,全职,"职位诱惑：10-15k职位描述：负责产品开发代码编写及自测工作。参与系统联调。职位Leader李睿CEOLeader亮点5G管理风格结果导向,追求卓越,鼓励创新工作地址成都-高新区--德德路333号B座19层查看地图职位发布者:李睿CEO",芯通软件
https://www.lagou.com/jobs/7109313.html?show=71c9fe12c229472b9ad2595346a8104c,推荐/搜索算法专家,30k-60k,/北京/,经验不限/,学历不限/,全职,职位诱惑：核心事业部，发展潜力大职位描述：1、参与和负责支付宝核心场景搜索推荐算法研发，深度Query与用户理解、深度个性化召回排序技术、机制与策略、智能交互、端智能算法等。2、支撑业务需求快速迭代，持续创新突破核心技术，优化平台用户体验和业务价值。3、对业务和技术方向有深度洞察，持续关注前沿进展，对搜索推荐领域富有极大热情。职位描述1.两年以上机器学习应用经验，有搜索、推荐、广告等领域丰富的实战经验，在Query与用户理解、召回排序、机制设计、智能交互、端智能中一个或多个领域有深入实践；2、熟练掌握机器学习算法原理，能熟练运用机器学习、自然语言处理、匹配技术、预估、运筹优化、强化学习、智能生成等技术解决有挑战性的问题，有业界顶会论文发表优先；3、对数据敏感度极高，有良好的逻辑思维和定义以及解决问题的能力4、优秀的组织协调能力，能够整合资源完成有挑战的目标。工作地址北京-朝阳区-东三环中午一号环球金融中心东塔9楼查看地图职位发布者:次次招聘,蚂蚁金服集团
https://www.lagou.com/jobs/7113468.html?show=ea0f777beea049f59ea337745714f9f3,工艺售前工程师,9k-16k,/上海/,经验5-10年/,本科及以上/,全职,职位诱惑：技术提升，福利，文化氛围良好职位描述：职位描述（工作内容和主要职责）：1、市政污水处理领域的工艺模型产品研发与技术支持；2、为市场开发以及销售人员提供技术支持，包括技术交流、技术方案、标书编制、技术分析等；3、为项目调试、交付提供必要的技术支持；4、根据公司技术文档规范编写相应的技术文档；5、领导下达的其他工作任务。职位要求：1、环境工程、环境科学、给排水工程及其相关专业，硕士研究生以上学历【本科以上必须，硕士非必须】；2、熟练掌握水处理基础知识，污水处理工艺技术相关工作经验3年以上【必须】；3、城市生活污水工艺技术相关工作经验优先【非必须】；4、市政项目招投标相关工作经验优先【非必须】；5、熟练使用CAD、Matlab、Office等软件【必须】；6、耐心细致，有责任心；7、工作勤奋，有较强的学习能力，善于分析思考问题；8、有时间观念，独立性强，思路清晰，具有团队合作精神。9、沟通表达能力优秀，感染力和引导力强【必须】。工作地址上海-徐汇区-上海市徐汇区龙兰路277号1号楼10楼查看地图职位发布者:EvaYang招聘主管,昊沧
https://www.lagou.com/jobs/7115645.html?show=8b16dd5f4c384a239b39aa40dd0801ef,cocos2d-x,10k-15k,/北京/,经验1-3年/,本科及以上/,全职,职位诱惑：五险一金、交通补、餐补职位描述：岗位职责：1.使用Cocos2d-x开发iOS、Android跨平台游戏；2.负责游戏前端的架构，模块设计以及代码实现；3.与服务器端程序进行充分协商，完成接口设计；4.与策划和美术进行协作，完成设计内容。任职要求：1.热爱游戏，对游戏开发抱有极大的热情，关注游戏体验；2.1年以上使用cocos2d-x引擎开发的经验；3.拥有安卓、IOS开发经验者优先；4.有较强的责任心，善于学习，良好的团队精神；5.具有良好的沟通能力，为人踏实，积极主动。工作地址北京-西城区-鼓楼西大街41号1号楼3层查看地图职位发布者:陶陶小姐职位发布者,动信通科技
https://www.lagou.com/jobs/7119382.html?show=61de0e614aa64d2bacc5f301e5533071,单片机工程师,20k-26k,/深圳/,经验5-10年/,大专及以上/,全职,"职位诱惑：氛围轻松,免费午餐,周末双休,年底双薪职位描述：工作内容：1.负责公司游戏外设产品的固件开发，外设包括不限于键盘、鼠标、游戏手柄（有线/无线）。2.与硬件工程、软件工程、产品开发、营销团队紧密合作，执行项目经理安排的计划，确保产品准时上线。3.与内部质量保证团队紧密合作，及时解决产品遇到的专业问题。任职要求：1.至少5年以上单片机开发的工作经验（不含实习）。2.熟练使用C语言，且熟练使用KeilIDE开发ARM以及ARMCortex-M系列的MCU（M0/M0+/M3/M4）。3.熟悉2.4G私有协议和低功耗蓝牙协议（HIDProfile及各类通用服务，如电池，信息等）。4.熟悉通用串行接口协议，I2C，SPI，I2S，UART等。5.对USBHID协议有一定的了解。6.较好的英文基础，英语四级及以上优先考虑。7.【有以下工作经验者优先考虑】　①USBHID或者无线产品（键盘、鼠标、耳机、游戏手柄等）。　②熟悉以下系列的MCU：NXPLPC1xxx,STM32Lxx,STM32Fxx,NRF518xx,NRF528xx等。　③设计过产品的USB启动引导程序，熟悉单片机启动引导过程。工作时间：1.朝九晚六，弹性半个小时，提供免费午餐。2.周未双休，按国家法定节假日放假，享受充足的全薪年假和病假。工作地址深圳-南山区-科技园-科技南路威新软件园2号楼查看地图职位发布者:LLucineHR",雷蛇深圳
