jobUrl,jobName,jobSalary,jobLocation,jobExperience,jobDegree,jobType,jobDetail,jobCompanyName
https://www.lagou.com/jobs/7119060.html?show=c0926ea124014ea99d8c10ec8a6c9b93,c++,8k-16k,成都,经验3-5年,本科及以上,全职,,易宝软件科技（南京）有限公司
https://www.lagou.com/jobs/7119060.html?show=ceaeb80d5da34775a3654840ae51ed94,c++,8k-16k,成都,经验3-5年,本科及以上,全职,"职位诱惑：五险一金周末双休弹性工作职位描述：CC++工作职责：1.负责公司产品功能模块的编码、单元测试、系统联调及维护工作；2.承担产品部分新功能的预研和开发；3.团队协作，参与项目的技术难点攻关；任职要求：1、本科计算机相关专业，熟练掌握cc++语言,熟悉Linux系统或windows系统；2、熟悉面向对象的设计思想和方法，理解和应用常用数据结构及算法；3、熟悉TCPIP协议，了解常用协议（如IP、TCP、UDP等）5、能独立完成特定模块的设计、开发、维护工作；6、思路清晰，具备良好的逻辑思维能力、自学能力和独立解决问题的能力；工作地址成都-郫县-犀浦-国腾科技园查看地图职位发布者:彭彭招聘",易宝软件科技（南京）有限公司
https://www.lagou.com/jobs/4385584.html?show=f6bb4cd3557349b9a93323256c5c701f,Java高级开发工程师,25k-40k,北京,经验5-10年,本科及以上,全职,"职位诱惑：发展空间大,弹性工作制职位描述：岗位职责：02020202020202021.参与拉勾网B端产品设计、研发，以及功能迭代，解决线上系统问题0202020202020202022.参与软件设计的重构、优化，保证产品的可迭代可维护性0202任职要求：0202020202020202021.有5年以上互联网工作经验，本科以上学历。0202020202020202022.数据结构算法基础扎实0202020202020202023.JAVA基础扎实，精通io、多线程并发、集合等基础框架，熟悉jvm调优0202020202020202024.熟悉Mysql，有数据库设计经验，做过sql优化，处理千万级别数据02020202020202025.具有出色的抽象设计能力，能独立分析和解决问题0202020202020202026.灵活设计原则，设计模式。0202020202020202027.技术栈：Spring、Mybatis、Mysql、Redis、ES、Kafka、RPC0202020202020202028.有产品意识，能够在技术侧输出观点，关注产品效果02020202020202029.有很好的分析问题和解决问题的能力，责任心强，善于学习，善于沟通和表达，有良好的团队合作意识0202加分项：020202020202020202开源项目020202020202020202带人经验工作地址北京-海淀区-北京大学-中关村查看地图职位发布者:leo开发组长",拉勾网
https://www.lagou.com/jobs/6758992.html?show=f6bb4cd3557349b9a93323256c5c701f,高级后端开发工程师（Java）,20k-30k,北京,经验3-5年,本科及以上,全职,职位诱惑：上市公司，发展好一日三餐+下午茶职位描述：岗位职责02021.负责BI系统的架构设计和技术开发工作；02022.负责高质量的设计和编码，承担重点、难点的技术攻坚；02023.参与产品讨论和开发实现；岗位描述02021.本科以上，4年以上开发经验；02022.具有良好的设计习惯和编码品味，热爱编码能产出高质量的设计与代码；02023.自带产品属性，善于总结，有较强的独自解决问题的能力；02024.精通JAVAGolangPython中的一种语言；02025.熟练掌握Mysql、Redis、MQ等WEB组件；02026.有分布式系统开发经验者优先；02027.有B端SaaS产品开发经验优先020202工作地址北京-朝阳区-金辉大厦31层查看地图职位发布者:刘佳欣HR,Mobvista
https://www.lagou.com/jobs/7139579.html?show=65cb4a10c8384ecc8a53a46da528731e,c++高级工程师,20k-35k,深圳,经验5-10年,本科及以上,全职,职位诱惑：年终奖金及项目奖金，餐补职位描述：C++高级软件工程师（AI系统）02工作场景：该岗位属于交通视频集群处理分析软件开发岗位，产品应用于城市级交通流量分析和交通实体路径跟踪，拥有世界领先的性能指标和应用规模。该产品的核心引擎采用C++开发，运行于Linux环境下。产品涉及到的深度学习算法模型和计算机视觉算法由其他算法工程师开发。C++引擎主要功能是：调用深度学习框架，加载神经网络模型；接收视频流媒体，提取图像序列；把图像序列输入算法模型进行推理；调用计算机视觉算法，对视频帧图片进行加工；输出加工后的视频和结构化数据。该岗位尤其重视语言基本功和软件建模能力。02必备能力：1.02具有扎实的C++功底，代码简练，可读性强；能适应严格的静态检查；2.02能够用C++实现各种经典设计模式；3.02能熟练运用C++11以上版本特性，如智能指针、类型自动推导、右值引用，等等；熟练掌握泛型编程和STL库调用；4.02对C++多线程内部机制有较好理解，概念清晰；5.02能够自如地阅读英文资料；6.02能在Linux环境中工作（研发工程师只配备Linux电脑）；7.02掌握单元测试基本技术；如果基本功（以上第1、2、3、4点）特别扎实，学习能力强，其他要求可放宽。02加分能力：1.02有下列开发库的开发经验：Qt、Protobuf、Kafka、MongoDb；2.02适用代码静态检查工具，有相关工作经验，如：PC-lint、CppCheck；3.02有持续集成和持续交付的经验，熟悉相关工具，如：GitlabCI、CMake、LinuxShell、Docker、Jenkins、Ansible或类似工具；4.02有一些人工智能技术基础（如OpenCV编程经验）02待遇：年薪24－40万。学历与工作经历要求：本科毕业5年以上、或硕士毕业2年以上工作经验。期望到岗时间：2020年4－10月期间。工作地点：深圳。注意事项：应聘现场有编程考试，时间约20分钟。工作地址深圳-南山区-南油-深圳湾生态科技园9栋B1座11楼查看地图职位发布者:黄慧卿人事,深研人工智能
https://www.lagou.com/jobs/7229030.html?show=65cb4a10c8384ecc8a53a46da528731e,主管高级c++开发工程师（...,15k-20k,深圳,经验3-5年,本科及以上,全职,职位诱惑：上市公司、股权激励、技术牛人多职位描述：岗位职责：负责客户端功能的维护及客户端新功能插件的开发。岗位要求：1、熟练音视频功能开发；2、有视频录制及播放器(VLC)功能开发经验;3、熟练运用ffmpeg、QT等开源库；4、Electron桌面开发程序经验者优先；工作地址深圳-南山区-大冲-高新南五道金证股份大楼8楼查看地图职位发布者:叶叶B招聘主管,金证股份
https://www.lagou.com/jobs/7173787.html?show=281ffb646ff8462384412d403151cd6b,区块链品牌经理,10k-20k,深圳,经验3-5年,学历不限,全职,职位诱惑：五险一金弹性工作餐补交通补职位描述：职位描述：1、会事件营销，热点营销，品牌营销；2、会制造热点，创造话题，吸引眼球；3、熟悉区块链行业媒体资源，促进品牌露出，增加品牌曝光；4、能够持续不断的联合第三方资源在业内进行品牌发声；5、懂视频营销，拍小视频以及直播；6、组织及参与线上线下活动，树立正面品牌形象。职位要求：1、本科及以上学历，形象好气质佳优先；2、有一定的区块链行业资源，如媒体资源、项目资源、KOL资源等;3、具备创意营销、思维活跃，能搞事情；4、具备良好的沟通协调能力和团队精神，出色的沟通谈判能力和应变能力，思路清晰、严谨，具备良好的抗压能力。工作地址深圳-南山区-南油-软件产业基地查看地图职位发布者:SHHR,鲸牙科技
https://www.lagou.com/jobs/7176057.html?show=281ffb646ff8462384412d403151cd6b,区块链行业记者,6k-12k,深圳,经验1-3年,大专及以上,全职,"职位诱惑：新颖好玩氛围好年轻化发展大双休制职位描述：职位诱惑1.不定期团建活动2.工作日奶茶水果换着来3团队成员各自身怀绝技,让你大开脑洞,一起奋斗一起疯4公司有弯有直、开放多元5对于表现突出者将给与期权奖励6有机会对接行业各大佬及上流课程学习机会岗位职责1.对区块链行业敏感,及时了解国内外区块链、金融、科技领域发展趋势和大公司动态2.紧跟热点事件,独立视角解读、撰写原创稿件;3、区块链、数字货币行业内的采访报道,主要以采访特定区块链项目方、机构方为主,准备采访问题,并把控采访质工作地址深圳-福田区-新媒体广告产业园八楼查看地图职位发布者:陀螺科技HRM",陀螺科技
https://www.lagou.com/jobs/5479206.html?show=3b9457ff1ad547a89d6d341d0e969482,web前端开发工程师,9k-12k,武汉,经验3-5年,本科及以上,全职,"职位诱惑：做五休二职位描述：1.2年以上前端开发相关工作经验2.有良好的编码习惯，沟通能力和快速学习能力3.至少参与过一个以上的大型项目的设计与开发工作，具备构建复杂应用的能力；4.熟练掌握HTML0202CSS0202JS(包括AJAX和JS面向对象原理等)5.理解Web标准,02熟练解决主流浏览器的兼容性问题（IE、Chrome、Firefox，移动端)至少熟练掌握一个主流前端框架，如：React\Vue\Angular\Backbone等，对其有深刻理解。工作地址武汉-洪山区-关山-光谷大道特一号国际企业中心5号楼查看地图职位发布者:唐凯人事招聘",朗蕴科技
https://www.lagou.com/jobs/5702071.html?show=387d6c50e3db434a9de285ecbb71948f,深度学习算法工程师,25k-50k,上海,经验1-3年,硕士及以上,全职,"职位诱惑：年底多薪技术大牛学术氛围好成长迅速职位描述：职位描述：负责公司智能产品的研发，核心技术为：目标检测，物体识别，视频行为分析，人物跟踪等。职位要求：1.0202计算机或者电子类相关专业，硕士或者博士学历。2.0202了解机器学习算法，熟悉CNN，02RCNN等网络的应用，以及优化技术。3.0202熟悉以下深度学习的框架应用中的任意一种：Caffe,Pytorch,02TensorFlow。4.0202很强的写代码能力，python或者C5.0202熟悉图像识别算法，以及GPU计算相关经验的优先考虑。公司介绍：我们是做人工智能产品的技术型公司，为零售行业提供解决方案，已经在市场上取得领先地位，并得到了资本市场的认可。我们在图像商品识别的深度学习领域有世界前沿性的研究成果，在目标检测方面有独创的核心技术，为腾讯云，京东，小红书，搜狗，百联集团等**企业提供技术服务。创始团队来自百度硅谷深度学习研究院，核心技术团队来自国内外知名学府：清华，上海交大，加州伯克利，卡耐基梅隆，佐治亚理工，并曾在Google,Yahoo!,02百度等互联网公司担任核心技术岗位。工作地址上海-浦东新区-博霞路22号S座306查看地图职位发布者:娄雅男人事总监",海深科技
https://www.lagou.com/jobs/6469225.html?show=387d6c50e3db434a9de285ecbb71948f,深度学习算法工程师,15k-30k,长沙,经验3-5年,硕士及以上,全职,职位诱惑：弹性工作、技术大牛、**团队、零食茶饮职位描述：工作内容：1.深度学习计算机视觉技术研发，领域包括但不限于图像分类、目标检测、目标识别、关键点检测、语义分割等。2.深度学习下，针对特定硬件特点的网络结构模型设计与搜索。岗位要求：1.计算机视觉或相关方向硕士及以上；2.具有良好的能动性、沟通能力、团队合作精神；3.熟练掌握CC++、Python，有相关项目经历；4.能够跟踪最新技术，熟练阅读领域论文，并拥有较强算法实现能力，有ACMICPC等编程竞赛经验者优先；5.熟悉并熟练使用Caffe、MxNet、Tensorflow、PyTorch等任一种深度学习开源框架者优先；6.熟悉神经网络模型的设计、调参、优化方法，熟悉小模型、移动端模型调参者优先；7.对样本敏感，有过基于大规模样本的机器学习（深度学习）项目者优先。工作地址长沙-开福区-北辰三角洲B1E1区1栋查看地图职位发布者:HR职位发布者,开易科技
https://www.lagou.com/jobs/6493498.html?show=387d6c50e3db434a9de285ecbb71948f,SPBU-算法工程师（AI算法优...,30k-40k,广州,经验3-5年,硕士及以上,全职,职位诱惑：餐饮补贴大平台五险一金职位描述：工作职责:1、与AI算法团队紧密合作，负责AI算法在CPU、GPU等处理器上的模型，并进行压缩和优化；2、提高模型性能、降低部署成本，封装成SDK供业务端使用；3、帮助AI算法在项目中快速落地。任职资格:1、计算机、通信、电子等相关专业，硕士以上学历，三年以上工作经验；2、精通C++、Python，具备良好的代码书写规范和文档编写能力；023、熟悉tensorflow等深度学习框架，熟悉CNN、RNN、LSTM等常用神经网络模型代码实现，精通网络剪枝、量化等算法优化方法；024、熟悉ARM、X86、GPU架构体系，熟悉并行计算软件开发，具有丰富的汇编、CUDA编程经验；5、良好的英语阅读能力，良好团队合作精神，有责任感，学习能力强，追求卓越；6、加分项：1有视频视觉质量优化经验2有美颜、贴纸等图像处理算法经验3有视频编解码优化经验。工作地址广州-天河区-东圃-羊城创意产业园1-17查看地图职位发布者:酷狗招聘招聘主管,酷狗音乐
https://www.lagou.com/jobs/6583846.html?show=387d6c50e3db434a9de285ecbb71948f,深度学习算法工程师,18k-36k,广州,经验不限,本科及以上,全职,职位诱惑：五险一金周末双休晋升空间年底双薪职位描述：职责描述：1、根据业务需求，负责自然语言处理方向的算法研究、产品开发和性能提升。2、负责领域相关的语料库的收集以及知识图谱的构建。深入研发自然语言处理相关的算法，参与相关产品系统的研发。任职要求：1、本科（统招）及以上学历，计算机、数学、通信等相关专业，3年以上工作经验，有自然语言处理项目经验。2、熟练掌握自然语言处理，信息检索和机器学习的基本方法。3、具备算法产品化能力，熟练掌握CC++JavaPython一种或以上编程语言。4、熟悉至少一种深度学习框架：PyTorch、Tensorflow、Keras、Caffe2、MxNet。5、对新技术有强烈的求知欲望，乐于钻研，善于分享。工作地址广州-番禺区-广州大学城青蓝街28号创智大厦查看地图职位发布者:HhrsHR,新文溯科技
https://www.lagou.com/jobs/7234043.html?show=3b9457ff1ad547a89d6d341d0e969482,web前端开发工程师,20k-30k,成都,经验不限,本科及以上,全职,职位诱惑：超强技术氛围、租房补贴、免费三餐职位描述：1、实时监控各业务运行状态（包括主器、服务、业务指标等各类监控）；022、提供智能的运维管理（管理海量的线上主机以及上面的各类存储服务）；023、提供秒级的响应报警以及安全审计保障。职位要求1、熟练掌握各种前端技术，包括HTMLCSSJavaScriptNode.js等；2、深入了解JavaScript语言，使用过React或Vue.js等主流开发框架；具备以下条件之一者优先：1、有云平台相关经验优先；2、有存储产品管理平台相关经验优先。工作地址成都-成华区-字节跳动查看地图职位发布者:刘亚男Web前端开发工程师,字节跳动
https://www.lagou.com/jobs/5864886.html?show=2062b1177cfd487bbb5840dca0ed85d1,搜索算法技术专家-闪购事业部,40k-60k,北京,经验5-10年,本科及以上,全职,职位诱惑：leader岗，发展空间大职位描述：职位描述：1.负责闪购零售业务搜索排序模型的研发工作，持续迭代提升转化效果和用户体验；2.探索闪购零售商品、商家搜索业务场景，落地搜索平台化服务最佳实践。任职要求：1.熟悉常用的机器学习算法；2.熟悉分布式计算平台海量数据处理，有Spark平台Scala语言开发经验者优先；3.熟悉常用的设计模式，代码整洁；4.优秀的分析及解决问题的能力，责任心强，细心耐心，有搜索排序模型研发经验者优先。工作地址北京-朝阳区-望京国际研发园恒基伟业大厦BC座查看地图职位发布者:碧琪美团点评招聘,美团点评
https://www.lagou.com/jobs/6938271.html?show=2062b1177cfd487bbb5840dca0ed85d1,搜索算法工程师,25k-50k,深圳,经验3-5年,本科及以上,全职,职位诱惑：自有平台用户量大欧美市场职位描述：工作内容：1、参与搜索引擎的研发工作，负责搜索语义向量召回，term召回，query意图识别，以及召回结果排序模型的建设;2、提升搜索质量负责召回相关性和语义向量的持续优化;3、应用机器学习、NLP等技术处理海量数据，分析和挖掘各种潜在关联，构建电商知识图谱和用户画像。岗位要求：1、优秀的分析问题和解决问题的能力、能够将复杂的业务场景分解、抽象成标准化的业务模型；2、扎实的代码能力、数据结构和基础算法功底，至少熟练掌握PythonJavaCC++Golang等一门编程语言；3、参与过搜索实际项目的开发，有丰富的架构设计、特征工程、画像体系建设等方面经验，熟练掌握基本的召回和排序算法，并对领域前沿算法有研究；4、对技术有热情，有良好的沟通表达能力和团队精神。工作地址深圳-南山区-科技园-科兴科学园查看地图职位发布者:爱美购HRHR,爱美购
https://www.lagou.com/jobs/7051671.html?show=2062b1177cfd487bbb5840dca0ed85d1,搜索算法工程师,20k-30k,北京,经验1-3年,本科及以上,全职,"职位诱惑：五险一金、友爱团队、双休、饭补职位描述：职位描述：1、负责搜索服务的开发，为上层服务提供数据和接口支持；2、搜索效果优化；3、富文本(rst,latex)中的字符匹配(例如：数学题目）3、内容抓取等一些其它基础服务研发工作。任职资格：1、必须有可循的搜索和文本匹配相关的工作经验。2、最好对elasticsearch或lucene有开发或运维经验，对全文检索引擎底层原理有一定理解更佳；3、熟悉搜索引擎召回或者排序算法，熟悉NLP相关技术；4、对数据库、缓存、队列、分布式等技术有一定理解；5、拥有良好的代码习惯，遵循公司代码规范和安全规范；6、对搜索引擎有浓厚兴趣，希望深入钻研者优先考虑；7、对大数据相关技术和流式处理等技术与爬虫有一定理解者优先考虑；8、踏实诚恳、责任心强，有良好的沟通能力。工作地址北京-东城区-安定门-雍和宫查看地图职位发布者:EZerHR",EasyGroup
https://www.lagou.com/jobs/7065802.html?show=2062b1177cfd487bbb5840dca0ed85d1,搜索算法工程师-ToB,20k-40k,深圳,经验不限,本科及以上,全职,"职位诱惑：六险一金,弹性工作,免费三餐,租房补贴职位描述：职位职责：1、负责ToB业务电商搜索的rank、query分析、相关性计算、推荐等技术方向的深入研究，设计算法方案并调优算法效果；2、负责将算法成果工程化，应用到实际业务场景中，提升用户的搜索体验，以及排序场景的各项业务指标，包括相关性，点击率，转化率，退款率等；3、负责搜索算法、推荐等技术中具体方向的中长期规划和项目落地。职位要求：1、熟练掌握C++PythonShell等编程技能，有扎实的编程基础、良好的编程风格与工作习惯；2、有丰富的算法项目经验，熟悉SparseLR、DFFM、Deep&Wide、DSSM在大规模稀疏数据上的应用及优化；3、熟悉至少一种主流深度学习编程框架(TensorFlowCaffeMXNet)，熟悉常用的深度学习算法；4、具有独立解决问题的能力，良好的团队合作意识和沟通能力；5、对搜索引擎、推荐系统、计算广告相关领域有经验者优先。工作地址深圳-南山区-创业路3023号公园一号办公楼查看地图职位发布者:字节跳动HRHRBP",字节跳动
https://www.lagou.com/jobs/7084647.html?show=2062b1177cfd487bbb5840dca0ed85d1,资深搜索算法专家-音乐事...,50k-80k,杭州,经验5-10年,本科及以上,全职,职位诱惑：空间大职位描述：【职位描述】1、负责云音乐核心场景搜索算法研发，负责搜索算法体系重构升级，优化搜索排序算法，提高搜索的相关性以及整体转化率；2、支撑业务需求快速迭代，参与和负责搜索算法关键技术突破，包括Query理解、召回算法、排序算法等；3、对业务和技术方向有深度洞察，对搜索推荐领域富有极大热情，挖掘搜索潜在的可扩展场景，实现搜索智能化、场景化。【职位要求】1.5年以上机器学习应用经验，有搜索领域丰富的实战经验，有推荐排序优化相关经验。包括召回、在线排序、多样性等，包括分词、索引、意图分析等；2、熟练常用的大数据开发工具，例如hadoopsparkhive；能熟练运用搜索相关性的技术，包括分词、索引、意图分析等；3、优秀的分析能力、解决问题的能力，善于发现，喜欢挑战，有良好的沟通能力。工作地址杭州-滨江区-长河-网易大厦查看地图职位发布者:Michael...招聘经理,网易
https://www.lagou.com/jobs/5875369.html?show=0c0b8abcefcf4ad295c952a182ff1732,技术经理高级技术经理,30k-50k,北京,经验5-10年,本科及以上,全职,职位诱惑：改造中国制造；**C2M电商；已盈利职位描述：技术经理高级技术经理职责描述：1、根据公司平台发展和运营规划，管理并建设研发团队，带领团队完成公司制定的开发目标；2、全面负责所管理研发团队的建设和技术进步，包括系统架构设计、建设、维护、规范、安全等相关技术的管理工作；3、指导并参与核心系统的设计与开发实施，组织解决项目开发过程中的重大技术问题；3、负责落实公司项目开发流程、项目质量和项目开发进度的规划、控制、监督和管理等相关制度；5、培养团队梯队，提高团队整体专业技能。6、负责同产品、运营部门的沟通、合作。任职资格:1、统招本科及以上学历，3年以上互联网企业技术开发及管理经验，有大中型移动互联网项目研发经验者优先；2、熟悉互联网服务架构体系，精通服务端的整体构建及交互流程；3、有大型电商系统的开发及管理经验，有大型业务系统架构能力、大型分布式系统设计能力；有较强的复杂系统领域建模能力；4、熟悉多线程多进程编程，分布式并行系统设计，精通高并发、大数据、消息中间件、SOA等领域的相关技术和理论。5、具备较强的团队管理能力、项目管理能力、队伍培训能力，具备10人以上团队管理经验；6、具备创业般的工作激情，能承受巨大的工作压力，有超强的自我驱动能力。工作地址北京-朝阳区-朝阳北路237号复星国际中心（地铁呼家楼东大桥站步行5分钟到）查看地图职位发布者:必要商城人事部,必要商城
https://www.lagou.com/jobs/6168763.html?show=0c0b8abcefcf4ad295c952a182ff1732,技术总监cto,35k-45k,上海,经验5-10年,本科及以上,全职,职位诱惑：节日福利，餐补，带薪年假职位描述：职责：1.高度理解公司的发展战略，全面负责公司各平台系统的技术方向研究和总体规划，全面负责公司技术层面的所有管理工作；2.带领研发中心团队，实现产品开发，上线，维护工作高质量顺利执行，同时主导公司大数据和云平台的规划设计，技术实现和稳定运行；3.主导制定并持续优化研发工作流程和规范，保证高效率、高质量的技术产出，促进技术成功的沉淀和共享，确保技术成果持续有效性；4.主导产品优化和升级，通过技术和产品推动项目发展，为公司业务发展提供动力；5、负责技术团队的招聘、建设、培养和关怀，提升团队的工作质量、效率和技术能力，优化项目人员结构，明确职责，定期进行技术培训。任职要求：1、211、985或双一流院校本科及以上学历，计算机、软件工程相关专业；2、年龄35岁左右，条件优秀者可放宽；3、具备JAVA开发背景，产品设计理念，有架构师开发经验或者大数据产品开发经验优先；4、具备较强的分析能力、逻辑思维能力和开放式思维能力；具备中型规模以上的软件公司管理经验。工作地址上海-闵行区-上海市浦江镇联航路1188号浦江智谷商务园8号楼A区查看地图职位发布者:张同江副总经理,锋泾集团
