jobUrl,jobName,jobSalary,jobLocation,jobExperience,jobDegree,jobType,jobDetail,jobCompanyName
https://www.lagou.com/jobs/7260437.html?show=942f82087f9b49f899806a24c86d7225,客服专员,3k-4k,/萍乡/,经验1年以下/,学历不限/,全职,"职位诱惑：团队年轻，五险一金，节日独立职位描述：招聘岗位:客服专员岗位职责:1、负责接听客户来电,为客户提供解决服务，处理及时问题等相关事项;2.负责处理投诉,并眼进投诉事件的解决，直接与投诉客户沟通、调解，最终达成双方满意的结果;3.对投诉处理结果，进行跟踪并有处理记录,录入客户反馈信息，整理存档;4、其他客服相关工作。任职要求:1、35岁以下,有呼叫中心的呼入投诉相关经验优先;2、熟练的电脑操作,熟练使用Office软件;3、能够接受倒班制,服从上级工作安排;4.普通话标准，思路清晰，口齿伶俐，较强的沟通能力和服务意识，承压能力强。工作地址萍乡-湘东区-政务服务中心旁查看地图职位发布者:许柠招聘专员",锐博软件
https://www.lagou.com/jobs/7260980.html?show=942f82087f9b49f899806a24c86d7225,客服专员,4k-6k,/上海/,经验1-3年/,学历不限/,全职,职位诱惑：工作氛围好五险一金老板nice职位描述：我们需要您做：1、通过在线客服或客服电话处理并解答用户的问题；2、及时反馈和协助处理平台异常状况，和用户做好沟通；3、对工作流程及平台问题进行分析总结，并提出改善建议；4、挖掘用户潜在需求，为每一位用户提供周到的用户体验。5、完成领导交付的其他工作。我们需要您有：1.高中及以上学历，专业不限；2.有较强的逻辑思维能力和问题分析能力，思维敏捷，善于表达自己的观点和意见；3.熟悉行政办公工作，熟练掌握Word，Excel、PowerPoint等办公软件，熟悉行政办公信息化建设。3.具有较强的接待、管理和保密意识；优秀的团队合作精神，善于沟通，具有亲和力；普通话标准；工作地址上海-松江区--上海市松江区寅青路靠近上海市气象局工程技术园区查看地图职位发布者:冯宇升运营经理,宝溯百货
https://www.lagou.com/jobs/7261194.html?show=a56a288c81134b8e824963ae1c58162a,golang开发工程师,20k-36k,/北京/,经验5-10年/,本科及以上/,全职,职位诱惑：弹性上班、福利待遇好、发展空间大职位描述：1.负责现有的DSP产品维护和开发工作；2.负责响应运营新需求，负责与算法团队，大数据团队的沟通，协调资源完成现有DSP产品的改造工作；岗位要求：1.精通java基础，熟悉其流行框架开发，5年以上开发经验，有团队管理经验优先；2.熟悉多线程编程，分布式，缓存，消息队列等机制；3.熟悉JVM，包括内存模型、类加载机制以及性能优化；4.熟练掌握MySQL数据库，有MongoDB、Redis等NoSQL应用经验并能进行性能调优；5.良好的业务梳理、沟通能力，拥有完整的业务系统规划设计能力，数据库模型设计能力；6.熟悉微服务，有互联网开发经验优先；7.学习能力强，具备良好的问题定位、分析及解决能力，具工作责任心；8.有良好的编程和文档管理习惯，有良好的团队合作精神，能承受较大的工作压力。9.有golang开发经验和大数据经验者优先.10.有dsp开发经验者优先工作地址北京-海淀区-北京大学-海淀北二街8号中关村SOHOA区1101查看地图职位发布者:AliceHR,Yeahmobi
https://www.lagou.com/jobs/7261209.html?show=6ed4392dbe5a46cd84222ab64a67f2dd,逆向工程师,15k-30k,/深圳/,经验3-5年/,本科及以上/,全职,"职位诱惑：发展前景大技术大牛双休职位描述：岗位职责:1、开展Android相关程序的逆向分析工作；2、开展Android相关程序的开发工作；3、配合同事一起完成项目相关功能。岗位要求:1、熟练掌握Android/JNI开发调试环境，熟悉c/c++,Java开发语言，熟悉Android系统体系结构；2、熟练使用Android平台主流分析工具（IDA\GDB\JED）；3、熟悉Android的Hook技术，并有较多方案实践落地，能够提供标准数据接口；4、熟悉ARM体系结构，如果了解常见反调试技术更佳；5、有责任心、善于沟通、团队合作、解决问题能力强。工作地址深圳-福田区-上梅林凯丰路10号翠林大厦12楼查看地图职位发布者:EthelRrcruiter",爱加密
https://www.lagou.com/jobs/7261270.html?show=6ed4392dbe5a46cd84222ab64a67f2dd,嵌入式软件工程师,15k-30k,/佛山/,经验3-5年/,本科及以上/,全职,职位诱惑：住房补贴员工宿舍包三餐下午茶团建职位描述：一、主要职责1、基于X86/ARM架构Linux系统进行开发；2、参与开发Can、串口485/232/422、网口、USB、GPIO等接口驱动模块；3、参与开发Rola、wifi、蓝牙、GPS、IMU、激光雷达、伺服电机等硬件模块；4、对软件模块进行调试和自测试；5、编写设计文档、操作说明文档等；6、配合整机系统的调试、测试和验收。二、任职要求1、2年以上嵌入式软件开发工作经验，有实际产品开发经验，有Linux开发相关经验；2、精通C/C++等编程语言，熟悉实时操作系统相关开发；3、熟悉Linux驱动开发，有驱动开发相关经验及熟悉硬件相关接口开发优先；4、有较强的分析问题解决问题的能力，能够承受一定的工作压力；工作地址佛山-顺德区-顺德工业园查看地图职位发布者:宋丁娜HR,城阳区雪之梦服装加工部
https://www.lagou.com/jobs/7261597.html?show=6ed4392dbe5a46cd84222ab64a67f2dd,linux驱动开发工程师,15k-30k,/佛山/,经验3-5年/,大专及以上/,全职,职位诱惑：住房补贴员工宿舍包三餐下午茶团建职位描述：1、基于X86/ARM架构Linux系统进行开发；2、参与开发Can、串口485/232/422、网口、USB、GPIO等接口驱动模块；3、参与开发Rola、wifi、蓝牙、GPS、IMU、激光雷达、伺服电机等硬件模块；4、对软件模块进行调试和自测试；5、编写设计文档、操作说明文档等；6、配合整机系统的调试、测试和验收。二、任职要求1、2年以上嵌入式软件开发工作经验，有实际产品开发经验，有Linux开发相关经验；2、精通C/C++等编程语言，熟悉实时操作系统相关开发；3、熟悉Linux驱动开发，有驱动开发相关经验及熟悉硬件相关接口开发优先；4、有较强的分析问题解决问题的能力，能够承受一定的工作压力；工作地址佛山-顺德区-顺德工业园查看地图职位发布者:宋丁娜HR,城阳区雪之梦服装加工部
https://www.lagou.com/jobs/7261719.html?show=942f82087f9b49f899806a24c86d7225,客服专员,5k-7k,/上海/,经验1-3年/,大专及以上/,全职,职位诱惑：五险一金职位描述：工作职责1.负责受理各渠道进线用户咨询，热情并准确回答顾客问题，并做好跟踪处理，严禁引流至其他平台；2.耐心礼貌的解决顾客提出的售后问题，了解客户服务需求，无法处理的先安抚顾客，严禁顶撞顾客；3.记录工作中的疑难问题并及时反馈，做好相关数据统计工作，善于归类总结；4.学习和熟悉公司产品和相关知识，解答客户以及消费者的相关问题；5.积极配合上级主管，完成下达的其他任务。任职要求1.熟练使用电脑，会精通office操作，能熟练运营execl；2.年龄18-35岁，思维清晰，逻辑性强，具备较强的学习能力和适应能力；3.吐字清晰标准，沟通能力较好，具有亲和力，善于倾听，有同理心；4.有较强的服务意识，责任心强，能以良好的心态及时解决客户提出的问题和要求；5.认同公司的企业文化和价值观，有创新思维，善于接受新观念新趋势，吃苦耐劳，有协作精神，具备较强团队合作意识。工作地址上海-闵行区-剑川路953弄零号湾154号查看地图职位发布者:萱萱HR,中链区块链
https://www.lagou.com/jobs/7261840.html?show=745bd29b9691404db39b3da4ff4802d6,人事助理,4k-7k,/深圳/,经验1-3年/,本科及以上/,全职,职位诱惑：五险一金、13薪、房补、餐补职位描述：岗位职责1、参与员工的招聘，负责人才简历搜索和筛选；2、辅助开展员工培训、员工关系管理、绩效薪酬管理等；3、为丰富员工文化生活，协助组织开展各种企业文化活动；4、必要情况协助其他人事行政相关事务。任职资格1、人力资源管理、行政管理及相关专业本科以上学历；2、1-3年工作经验，优秀应届毕业生亦可；3、工作细致认真，原则性强，有良好的执行力及职业素养；4、积极主动，具备自我驱动能力，具有良好的沟通能力、极强的亲和力与服务意识；5、熟练使用常用办公软件及相关人事管理软件。工作地址深圳-龙岗区-布吉-李朗国际珠宝产业园深圳长广科技有限公司A31102查看地图职位发布者:陈春容人事助理,长广科技
https://www.lagou.com/jobs/7261940.html?show=745bd29b9691404db39b3da4ff4802d6,人事专员,6k-12k,/深圳/,经验不限/,学历不限/,全职,"职位诱惑：免费旅游职位描述：一、招聘人事文员，助理:若干1、年龄在21-40岁优先考虑；2、1年以上相关工作经验，文秘、行政管理等相关专业优先考虑；3、学历不限，欢迎应届毕业生加入；4、具有极强的学习、创新及沟通能力；会电脑操作岗位职责：1、负责招聘(公司提供58、**，**，******，店长直聘，百姓网站上发帖，网络招聘；人才市场，校园招聘等渠道……)2、每天负责通知面试人员来面试。跟踪，负责面试人员面试情况！3、组织、安排面试，并且进行人力资源初试；薪资：底薪4500+高提成＋奖金，月综合薪资6000-12000元/月,5天8小时职位Leader用户8725人事助理工作地址深圳-龙华新区--汇海广场B座23楼2303查看地图职位发布者:杨思杰人事助理",新龙电子
https://www.lagou.com/jobs/5516004.html?show=fd6e19510dea40a1b906c299fc9b12dd,11212H-服务器硬件解决方案经理,15k-30k,/深圳/,经验3-5年/,本科及以上/,全职,"职位诱惑：五险一金,绩效奖金职位描述：工作职责1、负责收集业务部门的需求、痛点，协同规划产品路标，以确保平安云使用的硬件产品在全行业拥有竞争力（先进性、成本、质量、交付能力）；2、负责服务器硬件解决方案的统筹管理及规划，协调内外部资源、确保硬件解决方案按客户要求落地交付，跟踪推动后续的优化工作；3、负责撰写硬件解决方案与相关文档，制定相关的标准及规范；4、负责收集行业趋势及业界主流技术，对负责的硬件解决方案进行市场调研及竞品分析；任职要求专业技能要求：1、计算机或相近专业本科及以上学历；2年以上相关工作经验；2、精通服务器硬件技术和主流产品；熟悉与PC服务器关联密切的网络、存储及IDC等技术；熟悉云平台KVM、Docker、CloudStack、Ceph、Hadoop等主流应用的技术方案；3、具体较强的文档撰写及沟通表达能力，熟练使用PPT、EXCEL等工具；4、具备行业视野，对行业发展趋势有敏锐的洞察力及创新意识，有较强的需求分析及解决方案规划能力，能提炼用户需求并转化为解决方案能力，具备商业敏感性；5、熟悉云平台产品及解决方案，具备相关工作经验优先考虑；业务知识要求：１、极强的工作责任心，严谨细致的工作态度，强大的执行力；自学能力及自主工作能力强，表达能力清晰，良好的团队合作精神和沟通协调能力；２、熟悉云计算技术工作地址深圳-南山区-嘉联支付大厦查看地图职位发布者:平安科技HR职位发布者",平安科技
https://www.lagou.com/jobs/3784801.html?show=36bcaa944ab2424ab70472e24c70b75f,Unity3D游戏开发,15k-30k,/深圳/,经验1-3年/,本科及以上/,全职,"职位诱惑：海外手游,绩效奖金职位描述：【岗位职责】1、负责使用Unity3D工具引擎，开发移动终端游戏；2、负责根据策划要求，与后台，数值和美术一起协作，完成相关的游戏功能开发；3、负责集成（或开发）相关插件实现游戏平台相关（IOS/Android）的功能需求。【任职要求】1、计算机相关专业毕业，本科及以上学历;2年以上项目经验。2、熟悉C/C++，java,ObjectC，C#任何一种开发语言，熟悉基本算法和数据结构；3、思维活跃，具有严谨的逻辑推理能力；4、责任感强，工作认真负责，富于团队精神和敬业精神以及独立解决问题的能力；5、热爱游戏，了解游戏行业工作性质，有志于在游戏开发方向发展，对游戏有独立见解。6、英语水平良好，能熟练阅读英文技术文档，具有良好的自学能力者优先。7.有独立游戏研发经验者优先。工作地址深圳-南山区-科技园-留学生创业大厦查看地图职位发布者:Yyans职位发布者",战吼
https://www.lagou.com/jobs/5597340.html?show=36bcaa944ab2424ab70472e24c70b75f,Unity3D开发工程师,15k-30k,/广州/,经验不限/,学历不限/,全职,"职位诱惑：互联网百强职位描述：【工作职责】游戏客户端1.负责游戏客户端开发，实现功能模块并进行相关的自测和优化；2.负责性能优化，渲染表现优化；3.负责新技术预研、框架搭建。Unity引擎1.使用Unity引擎进行客户端开发；2.负责3D场景实时效果的调优；3.负责新技术预研、框架搭建。【职位要求】游戏客户端1.熟练掌握C++,C#,lua,数据结构和算法，熟练使用Unity3D进行手游开发；2.熟悉常用设计模式、网络、界面开发，计算机图形学，图像处理，物理模拟；3.能够与策划、美术密切配合，进行各种必要的尝试和探索，以使功能达到设计要求并体验良好；4.能够与后台开发以及策划设计人员进行良好的沟通，高效的与后台开发合作设计编码和调试；5.有责任心，良好的团队合作能力和沟通能力。优势条件：1.具有移动平台（Android，iOS）开发调试能力优先；2.精通各类效果的shader开发，渲染调试能力优先。Unity引擎1.掌握常用的数据结构和算法；2.熟悉C#编程语言，掌握至少一种脚本编程语言；3.熟练使用Unity3D引擎；4.良好的逻辑思维和编程习惯，具备独立解决技术问题的能力；5.强烈的求知欲，和与之相适应的学习能力；6.善于沟通，要有团队合作精神；7.能承受一定强度的工作压力。优势条件：1.良好的3D图形学基础，具备Unity下的3D开发相关经验（渲染、光照、骨骼动画等）；2.熟悉或精通Python或Lua等脚本语言；3.了解人工智能相关的基本知识和技能。工作地址广州-萝岗区-伴河路查看地图职位发布者:HR职位发布者",多益网络
https://www.lagou.com/jobs/6237861.html?show=fd6e19510dea40a1b906c299fc9b12dd,硬件工程师,6k-9k,/成都/,经验1-3年/,大专及以上/,全职,"职位诱惑：绩效奖金，年终奖金，餐饮补贴，员工旅游职位描述：岗位职责：1.熟练掌握汇编、C语言编程；熟悉单片机相关电子电路硬件,能绘PCB板图和原理图等；2.完成产品研发和试制工作；3.进行产品测试和故障分析解决；4.研发用各种电子元器件的采购；5.填写各种产品数据及编写技术文档。任职资格：1、大专及以上学历，电子信息工程相关专业；2、有4层或以上电路板开发经验；3、熟悉电路设计，熟悉Protel或AD09；了解MSP430、STM32等，了解低功耗的单片机开发；4、能用C写简单的调试程序；5、熟悉硬件基本技术，掌握硬件测试的相关手段和工具使用方法；6、有基本的需求分析、系统设计与文档撰写能力；7、有医疗器械公司工作经验优先。工作地址成都-双流区-白家-成都市航空港珠江路空港国际城7栋1单元11楼查看地图职位发布者:MiaHR",成都淞幸科技
https://www.lagou.com/jobs/6399563.html?show=36bcaa944ab2424ab70472e24c70b75f,Unity3D开发工程师,9k-18k,/武汉/,经验1-3年/,本科及以上/,全职,"职位诱惑：公司和个人成长快，福利全面，团队氛围好职位描述：我们需要你来：1、使用Unity3D引擎进行iOS/Android平台手机游戏开发；2、游戏核心模块架构的搭建，相应模块的开发工作；3、针对各个发布平台进行游戏性能优化；4、与策划、美术、市场良好沟通，能按时高质量交付。我们希望你是：1、计算机及相关专业本科以上学历，有C、C++、C#或Java语言编程基础；2、良好的3D图形学基础，有两年以上unity3d的手游开发经验，熟悉Unity3D引擎架构设计；3、熟练掌握NGUI或UGUI的使用方法；4、热爱游戏事业,富有创新意识；5、具备独立思考,分析,解决问题的能力,有较强的自学能力和责任心。工作地址武汉-洪山区-光谷软件园F3查看地图职位发布者:周周清职位发布者",多比特
https://www.lagou.com/jobs/6473306.html?show=36bcaa944ab2424ab70472e24c70b75f,资深unity3d游戏开发工程师,15k-30k,/深圳/,经验5-10年/,大专及以上/,全职,"职位诱惑：年底双薪,员工旅游,五险一金,带薪年假职位描述：岗位职责：1、负责使用Unity引擎完成公司客户端游戏开发与设计；2、负责小型技术团队的技术管理工作，解决项目中技术问题，对组员进行管理与分配;3、准确的理解产品策划案，进行任务细分和工作量预估；4、可独立开发游戏，解决关键技术问题；5、与策划、美术、测试等部门协同工作，保证项目总体进度，按期完成项目；任职要求：1、大专及其以上学历，计算机相关专业者优先；5年以上Unity3D游戏开发经验，至少完整参与过一款Unity3D手游项目；2、熟悉Unity3D引擎架构设计，熟练使用Unity3D制作场景、UI及脚本；3、熟悉掌握c#和Lua或者laya；4、熟悉游戏常用算法；5、数学和图形学基础扎实，熟悉Direct3D或OpenGL；6、较强的逻辑思维能力，思维严谨，拥有独立解决问题的能力；7、热爱游戏，有休闲游戏开发经验者优先；工作地址深圳-南山区-深圳市南山区科技南三路007号达实智能大厦1602室查看地图职位发布者:动能无线人事助理",动能无线
https://www.lagou.com/jobs/6483069.html?show=fd6e19510dea40a1b906c299fc9b12dd,高级硬件工程师,10k-15k,/成都/,经验3-5年/,大专及以上/,全职,职位诱惑：绩效奖金，年终奖金，餐饮补贴，员工旅游职位描述：岗位职责：1.主持硬件团队的日常管理工作，包含职责分工、工作安排与指导等；2.负责公司硬件类产品规划及组织实施；3.负责公司硬件产品的方案设计，相关电子器件的选型和原理图设计，PCBLayout4.跟踪硬件研发类项目的进度，确保按质、量需完成；5.负责公司项目配套硬件的选型与技术配合工作；6.负责硬件团队内外工作协调以及技术交流；7.制定、审核公司硬件类产品的技术文档调试作业指导书等；8.完成上级交办的其它工作。任职要求：1.统招本科及以上学历，电子、自动化、通信类相关专业；2.五年以上相关工作经验，1年以上团队管理经验，具有良好的硬件产品基础；3.精通常见单片机系统，如STM32、51、AVR等，以及I2C、SPI、UART等通信接口，精通多种传感器底层驱动，具有CAN总线开发能力优先；4.具备丰富的电路设计经验，熟悉常用数字模拟电路、接口电路设计，具备EMC电路知识，熟悉cadence或AD至少一种电路设计开发软件；5.有射频硬件设计经验，精通TCP/IP通信，有无线、4G模块通信开发经验优先；6.较强的硬件电路焊接、调试与测试的动手能力强，能适应短期的出差；7.具备硬件整机的研发能力，从立项，需求、设计、研发、生产全流程工作经验。工作地址成都-双流区-白家-成都市航空港珠江路空港国际城7栋1单元11楼查看地图职位发布者:MiaHR,成都淞幸科技
https://www.lagou.com/jobs/6575858.html?show=36bcaa944ab2424ab70472e24c70b75f,Unity3d开发工程师,12k-20k,/广州/,经验3-5年/,本科及以上/,全职,职位诱惑：互联网轻松下午茶旅游奖金职位描述：职位描述：1.负责Unity3D手游项目的客户端重要功能模块开发2.参与Unity3D手游项目的性能分析和优化及技术难点攻坚任职技能要求：1.计算机/软件相关专业本科以上学历2.拥有3年以上游戏开发经验，2年以上Unity3D开发经验3.精通C++/C#/Lua4.熟悉UnityAPI，Unity底层运行机制，熟练使用基础插件，能够针对性能问题进行优化；5.至少完整参与过一款Unity3D上线项目6.具有Android平台或IOS平台的开发经验个人基本能力要求：1.生活工作态度积极，有足够的团队意识和协作精神2.敢创新、思维严谨、勇于承担3.有一定的独立设计、完成编码能力，注重代码质量和文档4.能够阅读英文技术文档工作地址广州-天河区-天园街道黄埔大道中309号羊城产业园自编3-23D，A楼二楼201查看地图职位发布者:灵感科技HRM,广州灵感
https://www.lagou.com/jobs/6779475.html?show=fd6e19510dea40a1b906c299fc9b12dd,搜狗糖猫-硬件研发项目经理,25k-35k,/北京/,经验5-10年/,本科及以上/,全职,职位诱惑：明星业务团队氛围好职位描述：项目背景以搜狗AI能力延展出的多种智能硬件产品。涉及AI能力包括麦克阵列、智能语音识别、语义理解、OCR识别、翻译、语音合成、搜索和问答等。糖猫系列产品包括糖猫儿童智能手表、糖猫在家机器人等，后续围绕儿童类用户场景将落地更多产品形态，在儿童类应场景中寻找更多产品突破，把搜狗糖猫打造成一个儿童品牌。岗位职责1、负责智能硬件产品研发项目管理，包括选型、设计、开发、量产等阶段；2、负责与各合作方进行硬件相关沟通协调，包括原厂、制造商、方案商；3、负责硬件供应链管理及生产管理，对供应链和成本管理非常精通；4、本岗位可base北京或深圳。任职要求1、5年以上硬件研发从业经验，5年以上消费类电子设备硬件开发或硬件管理经验；2、有供应链管理，成本管控或电子经验者优先；3、有百万智能硬件或硬件量产管理经验；4、有较强的沟通协调能力和主动性。工作地址北京-海淀区-五道口-中关村东路一号院清华科技园搜狐网络大厦查看地图职位发布者:sogouHR,搜狗
https://www.lagou.com/jobs/6824206.html?show=36bcaa944ab2424ab70472e24c70b75f,unity3d开发工程师,20k-40k,/杭州/,经验3-5年/,本科及以上/,全职,职位诱惑：五险一金周末双休员工活动福利齐全职位描述：岗位职责：1、负责3D引擎相关产品的应用功能的开发；2、负责3D渲染引擎相关功能的开发，例如光线追踪效果实现。岗位要求：1、掌握计算机图形学的基础知识，熟悉OpenGL和GLSL；2、熟悉计算几何，图像渲染，渲染引擎，仿真，虚拟现实等知识和概念；3、熟悉Unity3D或ORGE、OSG等3D渲染引擎，有相关实际项目开发经验；4、有微信开发经验者优先；有IOS开发经验者优先。工作地址杭州-西湖区-古墩路-紫金广场B座1610室查看地图职位发布者:卡卡HRBP,凌笛数码
https://www.lagou.com/jobs/6896065.html?show=36bcaa944ab2424ab70472e24c70b75f,Unity3d开发工程师,13k-20k,/深圳/,经验1-3年/,大专及以上/,全职,"职位诱惑：五险一金、国外旅游、年终奖、全勤奖职位描述：职位描述：1、挖掘和理解游戏策划和游戏工程需求，进行技术设计；2、基于Unity3D引擎进行游戏客户端逻辑开发；3、基于Unity3D进行游戏工具开发和游戏组件开发；4、针对各个平台进行游戏性能优化。【职位要求】1、大专及以上学历，计算机软件相关专业优先；；2、2年以上Unity开发经验，熟悉Unity游戏热更新、Unity工具开发，剧情编辑器等，有过完整项目经验；3、扎实的开发能力，坚实的数据结构和算法基础,精通C#语言,掌握设计模式，以及掌握良好的移动端开发技能；4、自我驱动，学习能力强，自我专业性要求高；5、良好的沟通能力，具备团队合作精神。工作地址深圳-宝安区-新安-深圳宝安区创业二路125号创锦1号A座205查看地图职位发布者:李小姐人事专员",广州果堤网络科技有限公司
