jobUrl,jobName,jobSalary,jobLocation,jobExperience,jobDegree,jobType,jobDetail,jobCompanyName
https://www.lagou.com/jobs/7260718.html?show=d849dc288b014ef582aed745a5da9f70,web前端开发工程师,12k-24k,/深圳/,经验3-5年/,本科及以上/,全职,"职位诱惑：五百强名企、行业领头羊职位描述：【工作职责】1、负责万科物业""住这儿""产品相关的前端开发工作;2、持续优化页面性能和用户体验;3、抽象通用功能组件,开发基础工具,提高团队效率;【能力要求】1、统招本科学历，熟练掌握各种Web前端技术(HTML5/CSS/Javascript/Ajax等),了解各项技术的相关标准;2、至少熟悉React/Vue/Angular中一种前端主流框架,有React开发经验者更佳;3、熟悉各种前端开发和测试工具(Fiddler/Charles,Postman,Webdevelopertools)等;4、熟练使用ECMAscript6,了解TypeScript,理解JS面向对象编程方法;5、熟练使用webpack等构建工具，能够掌握nodejs基本的开发技能;6、熟练使用Git,开发过程中严格遵循gitflow工作流;7、熟悉HTTP协议,移动端兼容,缓存等相关问题;【加分项】1、有eslint/tslint使用习惯;2、有前端性能优化经验,包括但不限于代码层面,架构层面,请求层面;3、提供个人项目,GitHub,知乎,技术Blog等链接;4、熟悉一种或多种后台开发语言(Nodejs/Java/Python/Go);5、有ReactNative/小程序的开发经验;工作地址深圳-福田区-深圳查看地图职位发布者:Vicky招聘与配置",万科物业
https://www.lagou.com/jobs/7260739.html?show=d849dc288b014ef582aed745a5da9f70,web前端开发工程师,7k-10k,/西安/,经验1-3年/,本科及以上/,全职,"职位诱惑：双休、提升技能快职位描述：岗位职责：1、参与PC端和移动端html5网页、管理后台、小程序等Web开发；2、根据开发进度，实施方案，完成相应模块的开发任务；3、根据研发规范和项目流程编写相关技术文档；4、熟练使用LayUI、ElementUI、VUE、MUI、Vant框架；5、熟悉微信开发，能快速对各种接微信开发项目的优先考虑！6、要求：本科以上学历！任职要求：1、精通div＋css，能熟练运用html,css网页制作，深刻了解各主流浏览器的兼容问题；2、熟悉html5，了解html5最新规范，能够熟练运用html5特征构建移动端的webapp；3、熟练javascript,ajax等开发；4、熟练LayUI、elementUI、Vue、Vant、mui等框架，使用过LayUI、elementUI组件库；5、对工作认真负责，尽职尽责，能够承受压力；，6、良好的沟通能力，团队意识；7、学习能力强，有创新精神。工作地址西安-高新技术产业开发区-高新一路正信大厦B座1604室查看地图职位发布者:王磊CEO/产品总监",西安天之星
https://www.lagou.com/jobs/7260774.html?show=d849dc288b014ef582aed745a5da9f70,web前端开发工程师,8k-12k,/成都/,经验1-3年/,本科及以上/,全职,"职位诱惑：五险一金、期权股票、餐补车补、节假日福利职位描述：任职资格02021、02三年以上网站开发相关工作经验，有复杂前端项目开发经历,能够独立完成产品中的功能模块；022、02熟悉HTML/HTML5，CSS/CSS3，DIV布局，精通02W3C02规范及主流浏览器的差异，有丰富的关于Web标准、易用性、浏览器端原理以及网站性能等方面的知识，能够准确还原设计图，并确保代码对各种浏览器的良好兼容性；023、熟悉响应式开发，熟悉并使用过less或sass优先,02熟悉Bootstrap02Foudation02AmazeUI中至少一种UI框架；4、熟悉JavaScript,02熟悉es502es6,02熟悉jQuery/zepto/YUI/MooTools/Dojo中至少一种框架，特别是jQuery。熟悉AJAX，能够与后台开发配合；025、熟悉前端mvvm:02Angular02Vue02React02Weex中至少一种开源框架优先；6、熟悉Node.js的使用，具有前端代码构建（Gulp/Grunt/Webpack/Browserify等）的经验,对前端工程化与模块化开发有一定了解，并有实践经验（如RequireJS/SeaJS等）7、熟悉网络请求及处理，熟悉WEB应用，熟练进行前后端应用整合及调试；熟练使用版本控制工具，如Git,02SVN等，熟悉PS，能熟练切图等,02了解后台语言PHP,Java优先。岗位职责021、负责公司Web系统前端页面以及移动端H5页面的设计编码工作；2、持续的优化前端体验，优化代码并保持良好兼容性，提升界面的友好和易用性；3、优化复杂页面的逻辑代码组织结构，并封装成公共组件供不同项目进行调用；4、优化页面加载效率，提升页面加载速度，降低网络请求频次及流量。5、参与WEB前沿技术研究和新技术调研工作地址成都-高新区-天府软件园D6二楼查看地图职位发布者:李蒙行政副总",好房通科技
https://www.lagou.com/jobs/7260933.html?show=d849dc288b014ef582aed745a5da9f70,web前端工程师,14k-20k,/上海/,经验3-5年/,本科及以上/,全职,职位诱惑：政府项目职位描述：中高级web，需要立即到岗1、Web前端程序开发为主；2、前端与后台服务数据交互的开发；3、能沟通，可以独立解决问题。任职要求：1、web前端开发经验，熟练掌握HTML、JavaScript、Ajax、CSS等Web开发技术；3、熟悉前端开发技术Vue.js，熟悉ElementUI等相关Vue.js的框架；至少用Vue.js开发过2个以上的项目3、具备多浏览器兼容经验，熟悉移动端web02app开发及多设备兼容性调试和后端交互；4、有良好的团队协作精神、工作责任心和较强的学习能力；5、有Weex开发经验的优先考虑工作地址上海-徐汇区-音乐学院-淮海中路1010号嘉华中心2903室查看地图职位发布者:天坊信息科技HRM,天坊信息
https://www.lagou.com/jobs/7261043.html?show=d849dc288b014ef582aed745a5da9f70,web前端开发工程师,8k-15k,/成都/,经验1-3年/,本科及以上/,全职,职位诱惑：专业领域职位描述：岗位职责：1.02负责web产品页面的布局，页面动效与交互的实现；2.02负责基于Canvas/WEBGL技术的产品开发；3.02负责前端技术选型、框架搭建、项目开发、程序优化、项目发布等流程；4.02负责前端与后台数据通信，能与后台人员高效沟通；5.02深入分析和解决前端遇到的各种跨终端和浏览器的兼容问题，保证页面响应速度和执行效率；任职要求：1.02深度理解js并熟悉ES6以上的新特性；2.02完成前端业务代码及JS组件的封装3.02精通HTML5/CSS3/JavaScript/JQuery/Ajax等相关技术；4.02熟悉MVVM模式原理，有独立开发Vue项目经验，熟练掌握Vue全家桶5.02熟悉SASS或LESS，熟悉Webpack模块构建工具，可以使用相应脚手架搭建项目；6.022年以上WEB前端开发经验；7.02本科，软件工程、计算机等相关专业优先；8.02有WEBGL（Cesium3D）或WEBGIS系统开发经验者优先；工作地址成都-双流县-双兴大道1号电子科大科技园查看地图职位发布者:张雪霏人事行政主管,远望探测
https://www.lagou.com/jobs/7261325.html?show=d849dc288b014ef582aed745a5da9f70,web前端开发工程师,13k-23k,/北京/,经验1-3年/,本科及以上/,全职,"职位诱惑：使用先进的技术开发新的系统职位描述：岗位职责：1、负责公司在线教育项目的前端开发工作,上线后的迭代优化;022、与产品、设计、后端紧密配合，按时高质量完成开发任务；3、保证系统实现的高性能、规范性、可维护性、复用性；4、参与项目需求分析与设计,从技术角度提出建议与支持;5、善于学习研究业界的前沿技术,并能迅速转化到潜在项目中;02基本要求：1、大学本科以上学历，计算机相关专业，2年以上Web前端开发经验2、扎实且与时俱进的前端基础知识，熟练掌握vue或react全套技术栈，具有前端工程化能力3、熟练掌握浏览器及网络协议原理，对页面适配及性能优化有丰富的经验4、有较丰富的toC项目经验，对产品体验有自己的思考和认知，追求卓越的用户体验，有教育相关项目优先5、代码干净整洁；逻辑思维缜密，熟悉互联网产品开发过程及相关工具的使用6、工作积极主动、有责任心，具备良好的沟通能力和团队合作精神7、对新技术有浓厚的兴趣，自我学习能力强，拥有优秀的逻辑思维能力与优秀的独立工作能力8、项目可展示，可以直接发送项目/Gihub/blog的访问地址过来工作地址北京-海淀区-苏州桥-北京市海淀区北三环西路99号院西海国际中心3号楼查看地图职位发布者:杨越高级技术经理",北京爱启航网络科技有限公司
https://www.lagou.com/jobs/7261332.html?show=ea70c9d77dc5408fa764ff8f38ad51ab,算法工程师（AI）,15k-25k,/深圳/,经验3-5年/,本科及以上/,全职,"职位诱惑：发展前景职位描述：工作职责:1、了解行业先进的算法，可以完整讲解算法的原理；2、负责把算法转化成产品；3、参与产品的测试和实际部署；4、针对应用场景做模型的二次开发；5、其他临时性工作及上级交办的其他事宜。任职资格:1、硕士及以上学历，计算机或数学、统计学等相关专业,2年以上机器学习算法应用相关的工作经验；2、自然语言处理方向有工作经验者优先，可以自主搭建开发框架；3、至少掌握一种开发语言，如c++、python等，有在github上参与开发工作经验者优先。熟练使用Linux系统命令行；4、曾经参与公开数据挖掘或算法开发竞赛并获奖者优先。工作地址深圳-南山区-科技园-科技中2路1号深圳软件园（2期）11栋702查看地图职位发布者:顾小姐HR",华云中盛
https://www.lagou.com/jobs/5477847.html?show=ab9e1999255d485d8896c728a4e602d0,搜索算法工程师,25k-50k,/北京/,经验1-3年/,本科及以上/,全职,职位诱惑：六险一金，弹性工作，免费三餐，租房补贴职位描述：职位职责：1、参与ByteDance搜索引擎研发工作，用最前沿的机器学习算法、海量的数据，做最激动人心的技术、给用户最好的搜索体验。2、参与头条/抖音/TikTok等核心产品的搜索研发工作，服务数亿全球用户；3、参与搜索核心算法改进，可能的方向包括：（1）NLP：将业界最先进的NLP技术应用到搜索算法改进中，包括纠错、分词、改写、TermWeighting、意图识别；（2）Ranking：解决千亿级网页的排序问题，攻克基础检索、相关性、意图理解、权威性、时效性等世界难题；（3）页面分析和摘要：从千亿网页中提取最有价值的信息，进行结构化字段提取、智能摘要生成、转码等工作来优化搜索体验；（4）链接分析：从万亿链接中找出最有价值的网页，优化链接质量、索引质量、垃圾作弊识别、调度策略等；职位要求：1、出色的分析问题、解决问题能力，总是能从纷繁复杂的数据中一眼看出问题本质；2、出色的机器学习（DeepLearning）、NLP和数据挖掘基础，并能很好地建模应用于解决搜索问题；3、强悍的代码能力、数据结构和基础算法功底；4、熟悉Linux开发环境，熟练使用C++和Python语言；5、有主流大规模搜索引擎算法优化经验者加分；6、如果你绝顶聪明，总是能7天深入一个全新的领域成为专家，则可以忽略以上所有要求。工作地址北京-海淀区-北三环西路43号中航广场1号楼（矮楼）查看地图职位发布者:魏颖HRBP,字节跳动
https://www.lagou.com/jobs/5523061.html?show=ab9e1999255d485d8896c728a4e602d0,搜索算法实习生,6k-8k,/北京/,经验不限/,本科及以上/,实习,职位诱惑：弹性工作，免费三餐，休闲下午茶，扁平管理职位描述：职位职责：1、参与ByteDance搜索引擎研发工作，用最前沿的机器学习算法、海量的数据，做最激动人心的技术、给用户最好的搜索体验；2、参与今日头条/抖音/TikTok等核心产品的搜索研发工作，服务数亿全球用户；3、参与搜索核心算法改进，可能的方向包括：（1）NLP：将业界最先进的NLP技术应用到搜索算法改进中，包括纠错、分词、改写、TermWeighting、意图识别；（2）Ranking：解决千亿级网页的排序问题，攻克基础检索、相关性、意图理解、权威性、时效性等世界难题；（3）页面分析和摘要：从千亿网页中提取最有价值的信息，进行结构化字段提取、智能摘要生成、转码等工作来优化搜索体验；（4）链接分析：从万亿链接中找出最有价值的网页，优化链接质量、索引质量、垃圾作弊识别、调度策略等。职位要求：1、出色的分析问题、解决问题能力，扎实的代码能力、数据结构和基础算法功底；2、有机器学习、NLP和数据挖掘基础和开发经验者优先；3、熟悉Llinux开发环境，熟练使用C++和Python语言；4、如果你绝顶聪明，总是能7天深入一个全新的领域成为专家，则可以忽略以上所有要求；5、2020年及以后毕业，实习时间不少于4个月，每周不少于4天；我们希望能有充足的时间培养你，也希望你能充分参与业务做出卓越的贡献。工作地址北京-海淀区-北三环西路43号中航广场1号楼（矮楼）查看地图职位发布者:魏颖HRBP,字节跳动
https://www.lagou.com/jobs/6123426.html?show=ab9e1999255d485d8896c728a4e602d0,搜索算法,40k-60k,/北京/,经验5-10年/,本科及以上/,全职,职位诱惑：技术积淀有成长，待遇丰厚有保障职位描述：岗位职责：1.负责智能推荐和搜索业务的技术研发、规划；2.优化搜索算法与策略，提供更匹配更智能的搜索结果；3.负责数据指标的建立和维护，更好地指导和验证技术方案；4.搜索排序新算法、搜索新范式的探索，预研以及原型搭建；5.支持各种垂搜业务，为各种垂搜需求提供检索机制/相关性调优支持；6.负责团队人才培养；任职资格：1.统招本科及以上学历，5年以上推荐、搜索、广告等领域丰富的实战经验；2.具备机器学习、自然语言处理、数据挖掘、图像处理、深度学习等相关专业或者相关项目经验；3.熟悉Linux平台，熟悉Shell/Python等常用脚本语言；4.对数据结构和算法设计有较为深刻的理解；5.优秀的分析问题和解决问题的能力，对解决具有挑战性问题充满激情；6.具备以下经验优先考虑：搜索/广告/推荐/文本挖掘/用户行为分析/Hadoop大规模数据处理等。工作地址北京-朝阳区-酒仙桥-酒仙桥路6号院（电子城61国际电子总部）查看地图职位发布者:郭先生招聘经理,360
https://www.lagou.com/jobs/6174007.html?show=ab9e1999255d485d8896c728a4e602d0,搜索算法工程师,20k-35k,/北京/,经验1-3年/,本科及以上/,全职,"职位诱惑：免费午餐,弹性不打卡，带薪年假11天起职位描述：岗位职责：负责搜索引擎核心算法和架构的设计和实现，并针对具体的业务挑战，不断优化，使之在效果和性能上达到行业最高标准；并服务于产品核心指标的提升任职条件：1、985、211院校计算机相关专业，两年或以上搜索相关工作经验2、熟悉信息检索理论，具备良好的系统编程，数据结构等基础能力3、对机器学习系统有一定了解，深刻理解并独立实现过相关算法4、熟悉优化的基础理论，能够将业务问题转化成相关的优化问题并求解5、良好的沟通能力与团队协作意识6、熟悉C++，python，SQL等语言；熟练使用ElasticSearch并有优化经验；熟悉Linux工作环境；工作地址北京-海淀区-宝盛路与黑泉路宝盛广场B座4层查看地图职位发布者:厨房君HRBP",下厨房
https://www.lagou.com/jobs/6576009.html?show=ab9e1999255d485d8896c728a4e602d0,搜索算法工程师,18k-36k,/武汉/,经验3-5年/,本科及以上/,全职,"职位诱惑：大平台,团队氛围,发展空间职位描述：工作描述：021.搜索垂类的策略及算法相关工作；2.搜索及相关领域的机器学习或NLP算法设计与应用。职位要求：1.3年以上工作经验，熟悉Linux环境下Java、python、SHELL等语言编程；2.对常用数据结构和算法有较为深刻的理解；3.优秀的分析和解决问题的能力，对挑战性问题充满激情；4.强烈的上进心和求知欲，较强的学习能力和沟通能力，具备良好的团队合作精神；5.具备一定机器学习背景，熟悉常见机器学习算法；6.具备搜索相关经验，在自然语言文本处理上有经验优先。ps：到岗时间可议~工作地址武汉-江夏区-流芳-金融港B24栋小米武汉研发中心查看地图职位发布者:余招聘专员",小米
https://www.lagou.com/jobs/6820197.html?show=ab9e1999255d485d8896c728a4e602d0,搜索算法专家,40k-70k,/北京/,经验5-10年/,本科及以上/,全职,职位诱惑：五险一金；自带电脑有补贴；5-10天年假职位描述：工作职责：021、负责公司搜索算法重构和优化工作，参与搜索框架设计与性能优化；022、负责搜索意图识别优化，对query进行模型纠错、概率扩展、规范化改写并对意图识别有效性进行评估，对少结果无结果进行效果优化；023、负责上位词、下位词、实体词挖掘并建立品牌、地址、类目、关键词词典。024、负责对商品进行匹配、分类、聚类，生成商品标签、推荐语等；025、参与ES索引性能优化02岗位要求：021、计算机或相关专业，大学本科及以上学历；022、4年及以上搜索业务开发经验，扎实算法基本功，熟悉主流机器学习和文本挖掘算法；023、熟悉java、Python等流行编程语言，熟悉tf、pytorch等框架，编程能力强。024、对大数据相关工具Hadoop，Spark，Storm，Hbase等有实际使用经验；025、有搜索、推荐或广告等行业背景优先。026、具备机器学习、自然语言处理、深度学习和良好的实践经验背景者优先。工作地址北京-大兴区-亦庄-北京经济技术开发区荣华中路22号亦城财富中心B座11层查看地图职位发布者:吴甜甜招聘,达达-京东到家
https://www.lagou.com/jobs/6890942.html?show=ab9e1999255d485d8896c728a4e602d0,搜索算法,25k-45k,/上海/,经验3-5年/,本科及以上/,全职,职位诱惑：五险一金，职业晋升，相关培训，周末双休职位描述：工作职责：基于ElasticSearch的搜索系统研发，构建能稳定运行的搜索集群，扩展现有搜索系统的功能。02职位要求：计算机相关专业本科及以上熟练掌握Java熟练掌握基本数据结构和算法熟知搜索引擎底层原理对自然语言处理和推荐系统有一定了解加分项：熟练掌握C/C++，深刻理解Linux以及网络编程原理参与过大型搜索系统的研发对机器学习有一定了解工作地址上海-浦东新区-南码头-尚博创意园东方路3539号2501-2505室(贰号楼3楼)查看地图职位发布者:sophieHRBP,韩创科技
https://www.lagou.com/jobs/6938271.html?show=ab9e1999255d485d8896c728a4e602d0,搜索算法工程师,25k-50k,/深圳/,经验3-5年/,本科及以上/,全职,职位诱惑：自有平台用户量大欧美市场职位描述：工作内容：1、参与搜索引擎的研发工作，负责搜索语义向量召回，term召回，query意图识别，以及召回结果排序模型的建设;2、提升搜索质量负责召回相关性和语义向量的持续优化;3、应用机器学习、NLP等技术处理海量数据，分析和挖掘各种潜在关联，构建电商知识图谱和用户画像。岗位要求：1、优秀的分析问题和解决问题的能力、能够将复杂的业务场景分解、抽象成标准化的业务模型；2、扎实的代码能力、数据结构和基础算法功底，至少熟练掌握Python/Java/C/C++/Golang等一门编程语言；3、参与过搜索实际项目的开发，有丰富的架构设计、特征工程、画像体系建设等方面经验，熟练掌握基本的召回和排序算法，并对领域前沿算法有研究；4、对技术有热情，有良好的沟通表达能力和团队精神。工作地址深圳-南山区-科技园-科兴科学园查看地图职位发布者:爱美购HRHR,爱美购
https://www.lagou.com/jobs/7084647.html?show=ab9e1999255d485d8896c728a4e602d0,资深搜索算法专家-音乐事业部,50k-80k,/杭州/,经验5-10年/,本科及以上/,全职,职位诱惑：空间大职位描述：【职位描述】1、负责云音乐核心场景搜索算法研发，负责搜索算法体系重构升级，优化搜索排序算法，提高搜索的相关性以及整体转化率；2、支撑业务需求快速迭代，参与和负责搜索算法关键技术突破，包括Query理解、召回算法、排序算法等；3、对业务和技术方向有深度洞察，对搜索推荐领域富有极大热情，挖掘搜索潜在的可扩展场景，实现搜索智能化、场景化。【职位要求】1.5年以上机器学习应用经验，有搜索领域丰富的实战经验，有推荐排序优化相关经验。包括召回、在线排序、多样性等，包括分词、索引、意图分析等；2、熟练常用的大数据开发工具，例如hadoopsparkhive；能熟练运用搜索相关性的技术，包括分词、索引、意图分析等；3、优秀的分析能力、解决问题的能力，善于发现，喜欢挑战，有良好的沟通能力。工作地址杭州-滨江区-长河-网易大厦查看地图职位发布者:Michael...招聘经理,网易
https://www.lagou.com/jobs/7109313.html?show=ab9e1999255d485d8896c728a4e602d0,推荐/搜索算法专家,30k-60k,/北京/,经验不限/,学历不限/,全职,职位诱惑：核心事业部，发展潜力大职位描述：1、参与和负责支付宝核心场景搜索推荐算法研发，深度Query与用户理解、深度个性化召回排序技术、机制与策略、智能交互、端智能算法等。2、支撑业务需求快速迭代，持续创新突破核心技术，优化平台用户体验和业务价值。3、对业务和技术方向有深度洞察，持续关注前沿进展，对搜索推荐领域富有极大热情。职位描述1.两年以上机器学习应用经验，有搜索、推荐、广告等领域丰富的实战经验，在Query与用户理解、召回排序、机制设计、智能交互、端智能中一个或多个领域有深入实践；2、熟练掌握机器学习算法原理，能熟练运用机器学习、自然语言处理、匹配技术、预估、运筹优化、强化学习、智能生成等技术解决有挑战性的问题，有业界顶会论文发表优先；3、对数据敏感度极高，有良好的逻辑思维和定义以及解决问题的能力4、优秀的组织协调能力，能够整合资源完成有挑战的目标。工作地址北京-朝阳区-东三环中午一号环球金融中心东塔9楼查看地图职位发布者:次次招聘,蚂蚁金服集团
https://www.lagou.com/jobs/7175325.html?show=ab9e1999255d485d8896c728a4e602d0,搜索算法高级工程师,30k-50k,/北京/,经验3-5年/,学历不限/,全职,职位诱惑：医疗独角兽业务广成长空间大挑战性职位描述：职位描述：1.负责好大夫搜索技术研究，包括查询理解、语义相关性、召回索引、转化率预估等核心技术；2.探索个性化搜索中深度学习、强化学习技术，并落地应用；3.探索前沿人工智能技术，并落地个性化搜索业务。职位要求：1.对NLP、图嵌入、语义技术、排序模型有深入的理解和应用经验，有搜索算法经验。2.熟练掌握机器学习、深度学习等方向理论和应用，动手能力强，有主动探索和思考。3.熟练应用算法平台，如TensorFlow、PyTorch等，熟悉Spark、Hive等大数据处理框架优先。工作地址北京-朝阳区-定福庄-北京市朝阳区三间房南里4号院DREAM2049国际文创产业园查看地图职位发布者:潘先生招聘专员,好大夫在线
https://www.lagou.com/jobs/7200802.html?show=ab9e1999255d485d8896c728a4e602d0,搜索算法工程师,30k-60k,/北京/,经验3-5年/,本科及以上/,全职,职位诱惑：核心团队发展空间大12天年假职位描述：【职责描述】：1.负责搜索相关性算法优化，包括文本相关性、图文相关性等；2.负责网民搜索意图分析，基于网民行为日志以及NLP等技术，识别网民真实意图，优化搜索结果；3.负责视频搜索排序算法的设计与实现，为爱奇艺用户提供最好的搜索体验；4.跟踪搜索、推荐以及深度学习等相关领域的前沿技术，并在实际业务中探索应用。【岗位要求】：1.计算机及相关专业本科及以上，相关领域2年以上工作经验；2.扎实的代码功底和工程开发能力，有较强的数据分析和解决实际问题的能力；3.熟悉hadoop/spark/flink等大数据处理工具，熟悉tensorflow等深度学习框架，对深度学习，算法优化问题有深入研究和理解者优先；4.熟悉主流的排序模型算法，有搜索、推荐和广告等相关业务经验者优先。温馨提醒：如果7天内您没有收到爱奇艺的面试邀请，那么目前我们不会安排您参加后续的面试环节，感谢您的理解和对爱奇艺的关注与认可。02工作地址北京-海淀区-中关村-海淀北一街2号爱奇艺创新大厦查看地图职位发布者:YMHR,爱奇艺
