jobUrl,jobName,jobSalary,jobLocation,jobExperience,jobDegree,jobType,jobDetail,jobCompanyName
https://www.lagou.com/jobs/6908074.html?show=670079a3e42d446cb769176d2696500f,AI算法质量工程师,20k-40k,北京,经验3-5年,本科及以上,全职,"职位诱惑：产品超赞,大牛团队,核心业务,薪酬福利好职位描述：职位描述：1、参与建立快手AI算法全方位的质量体系；2、保障拍摄、云端、播放环节的AI算法质量，提升视频、图像、直播中算法应用的准确性、健壮性、稳定性，打造业界最佳。任职要求：1、计算机、图像算法、多媒体通信等相关专业211本科以上学历；2、工作年限3年及以上，了解AI算法评测方法和测试流程；3、熟悉人脸识别、人脸关键点、美颜、肢体关键点、手势识别、背景分割、风格化等算法者优先；4、深入理解深度学习、机器学习、图像处理的基本原理和业界发展方向者优先；5、有自动化框架设计开发，自动化平台开发经验者优先；有性能压测，性能分析经验者优先。6、至少熟悉C++JAVAPython编程语言中的一种。工作地址北京-海淀区-西二旗-西二旗查看地图职位发布者:张女士招聘",快手
https://www.lagou.com/jobs/6950684.html?show=670079a3e42d446cb769176d2696500f,深度学习算法工程师,25k-40k,北京,经验3-5年,硕士及以上,全职,职位诱惑：17薪，午休两小时职位描述：该职位基于海量数据，利用深度学习等技术，为业务场景，提供包括模型调优，样本和特征选取的针对性优化。岗位职责：1、对全互联网数据和用户行为等大数据进行分析，利用深度学习模型深度挖掘可用信息；2、熟悉GAN、DNN、CNN、RNN等模型；3、研究方向包括但是不限于对各类深度学习模型的调优，对百亿千亿级别样本选取的优化，以及特征的优化和分析。任职资格：1、深度学习等相关专业、尤其是基于深度学习语义理解相关专业的硕士博士，或者在该领域有相关工作经验；2、熟悉人工智能领域前沿技术，例如GAN、强化学习，对深度学习语义理解领域在学术界以及工业界有前瞻性，兑深度学习模型调优，常用深度学习平台TensorFlow有深度的理解与优化经验3、能够从复杂的业务场景中进行算法选型、算法优化以及不断提升效果，对项目效果追求**，有极强的自我驱动力与学习能力；4、熟悉linux开发环境，精通python，熟悉Java或C++，扎实的数据结构和算法功底。工作地址北京-朝阳区-望京-望京绿地中心中国锦40层4002查看地图职位发布者:杨勇招聘经理,热云数据
https://www.lagou.com/jobs/7042446.html?show=670079a3e42d446cb769176d2696500f,深度学习算法工程师,15k-30k,杭州,经验3-5年,本科及以上,全职,职位诱惑：全额五险一金+丰厚年终奖职位描述：岗位职责：1.负责将训练完成的深度学习算法迁移到终端平台（移动端、设备端）2.开发和优化终端inference框架3.优化算子，负责完成特定平台的迁移过程中未实现的算子任职要求：1.精通cc++，精通算法与数据结构，熟悉python2.具备较好的计算机体系结构背景和软件开发背景，熟悉armneon指令及汇编优化，或者熟悉特定平台（海思NPU、N腾）优化3.了解计算机并行计算、异构计算4.了解深度学习基本原理，熟悉神经网络基本架构和各layer计算方式，熟悉至少一种深度学习训练框架及其模型文件的解析，如caffe、tensorflow、pytorch5.熟悉模型优化、量化优化、算子融合等相关优化手段6.了解tvm的核心，对模型编译IR设计端上高性能代码生成有了解工作地址杭州-西湖区-蒋墩路华策中心A座7F-12F查看地图职位发布者:T妹HR,涂鸦智能
https://www.lagou.com/jobs/7103523.html?show=670079a3e42d446cb769176d2696500f,深度学习算法工程师,25k-50k,上海,经验1-3年,本科及以上,全职,"职位诱惑：年底多薪发展空间大福利好待遇优厚职位描述：职位诱惑：年底多薪技术大牛学术氛围好成长迅速职位描述:负责公司智能产品的研发，核心技术为：目标检测，物体识别，视频行为分析，人物跟踪等。职位要求：1.0202计算机或者电子类相关专业，硕士或者博士学历。2.0202了解机器学习算法，熟悉CNN，02RCNN等网络的应用，以及优化技术。3.0202熟悉以下深度学习的框架应用中的任意一种：Caffe,Pytorch,02TensorFlow。4.0202很强的写代码能力，python或者C5.0202熟悉图像识别算法，以及GPU计算相关经验的优先考虑。公司介绍：我们是做人工智能产品的技术型公司，为零售行业提供解决方案，已经在市场上取得领先地位，并得到了资本市场的认可。我们在图像商品识别的深度学习领域有世界前沿性的研究成果，在目标检测方面有独创的核心技术，为腾讯云，京东，小红书，搜狗，百联集团等**企业提供技术服务。创始团队来自百度硅谷深度学习研究院，核心技术团队来自国内外知名学府：清华，上海交大，加州伯克利，卡耐基梅隆，佐治亚理工，并曾在Google,Yahoo!,02百度等互联网公司担任核心技术岗位。工作地址上海-浦东新区-张江-亮秀路112号Y1座查看地图职位发布者:高女士人事专员",海深科技
https://www.lagou.com/jobs/5864886.html?show=4ce1d540f98046efa00d98c30a9b206f,搜索算法技术专家-闪购事业部,40k-60k,北京,经验5-10年,本科及以上,全职,职位诱惑：leader岗，发展空间大职位描述：职位描述：1.负责闪购零售业务搜索排序模型的研发工作，持续迭代提升转化效果和用户体验；2.探索闪购零售商品、商家搜索业务场景，落地搜索平台化服务最佳实践。任职要求：1.熟悉常用的机器学习算法；2.熟悉分布式计算平台海量数据处理，有Spark平台Scala语言开发经验者优先；3.熟悉常用的设计模式，代码整洁；4.优秀的分析及解决问题的能力，责任心强，细心耐心，有搜索排序模型研发经验者优先。工作地址北京-朝阳区-望京国际研发园恒基伟业大厦BC座查看地图职位发布者:碧琪美团点评招聘,美团点评
https://www.lagou.com/jobs/6123426.html?show=4ce1d540f98046efa00d98c30a9b206f,搜索算法,40k-60k,北京,经验5-10年,本科及以上,全职,职位诱惑：技术积淀有成长，待遇丰厚有保障职位描述：岗位职责：1.负责智能推荐和搜索业务的技术研发、规划；2.优化搜索算法与策略，提供更匹配更智能的搜索结果；3.负责数据指标的建立和维护，更好地指导和验证技术方案；4.搜索排序新算法、搜索新范式的探索，预研以及原型搭建；5.支持各种垂搜业务，为各种垂搜需求提供检索机制相关性调优支持；6.负责团队人才培养；任职资格：1.统招本科及以上学历，5年以上推荐、搜索、广告等领域丰富的实战经验；2.具备机器学习、自然语言处理、数据挖掘、图像处理、深度学习等相关专业或者相关项目经验；3.熟悉Linux平台，熟悉ShellPython等常用脚本语言；4.对数据结构和算法设计有较为深刻的理解；5.优秀的分析问题和解决问题的能力，对解决具有挑战性问题充满激情；6.具备以下经验优先考虑：搜索广告推荐文本挖掘用户行为分析Hadoop大规模数据处理等。工作地址北京-朝阳区-酒仙桥-酒仙桥路6号院（电子城61国际电子总部）查看地图职位发布者:郭先生招聘经理,360
https://www.lagou.com/jobs/6174007.html?show=4ce1d540f98046efa00d98c30a9b206f,搜索算法工程师,20k-35k,北京,经验1-3年,本科及以上,全职,"职位诱惑：免费午餐,弹性不打卡，带薪年假11天起职位描述：岗位职责：负责搜索引擎核心算法和架构的设计和实现，并针对具体的业务挑战，不断优化，使之在效果和性能上达到行业最高标准；并服务于产品核心指标的提升任职条件：1、985、211院校计算机相关专业，两年或以上搜索相关工作经验2、熟悉信息检索理论，具备良好的系统编程，数据结构等基础能力3、对机器学习系统有一定了解，深刻理解并独立实现过相关算法4、熟悉优化的基础理论，能够将业务问题转化成相关的优化问题并求解5、良好的沟通能力与团队协作意识6、熟悉C++，python，SQL等语言；熟练使用ElasticSearch并有优化经验；熟悉Linux工作环境；工作地址北京-海淀区-宝盛路与黑泉路宝盛广场B座4层查看地图职位发布者:厨房君HRBP",下厨房
https://www.lagou.com/jobs/6554709.html?show=4ce1d540f98046efa00d98c30a9b206f,搜索算法,30k-60k,上海,经验3-5年,硕士及以上,全职,职位诱惑：16薪职位描述：1、负责电商业务中搜索或推荐算法的研发，并在各垂直业务中上线应用，包括排序算法召回优化相关性建模数据挖掘等工作，提升线上指标，用户体验以及商业化业务赋能等。2、计算机，自动化，电子通信，数学统计等相关专业本科以上学历，超过一年互联网搜索，推荐，流量或相关领域工作经验。扎实的机器学习深度学习自然语言处理数据挖掘理论基础，并且在某个方向上有深入的研究和积累。3、熟悉GoC++Java等其中之一开发工具，熟悉SparkHadoop等其中之一大数据处理平台，能够把握机器学习、自然语言处理、数据挖掘等领域的前沿动向，有自己的洞察力。4、具有落地向量召回类目预测CTRCVRLTR等工作经历加分；具有大型搜索、广告、或者推荐系统的实际研发经验者加分；在人工智能机器学习自然语言处理等领域**会议或者学术期刊发表论文者加分。5、优秀的分析和解决问题的能力，思路清晰，对工作上的挑战充满激情，具有强烈的工作责任感和团队合作精神。工作地址上海-浦东新区-浦东新区星创科技广场查看地图职位发布者:晓倩HR,趣头条
https://www.lagou.com/jobs/6636496.html?show=4ce1d540f98046efa00d98c30a9b206f,搜索算法,25k-50k,上海,经验1-3年,硕士及以上,全职,职位诱惑：大平台职位描述：1、负责电商业务中搜索或推荐算法的研发，并在各垂直业务中上线应用，包括排序算法召回优化相关性建模数据挖掘等工作，提升线上指标，用户体验以及商业化业务赋能等。2、计算机，自动化，电子通信，数学统计等相关专业本科以上学历，超过一年互联网搜索，推荐，流量或相关领域工作经验。扎实的机器学习深度学习自然语言处理数据挖掘理论基础，并且在某个方向上有深入的研究和积累。3、熟悉PythonGoC++Java等其中之一开发工具，熟悉FlinkSparkHadoop等其中之一大数据处理平台，能够把握机器学习、自然语言处理、数据挖掘等领域的前沿动向，有自己的洞察力。4、具有落地向量召回类目预测CTRCVRLTR等工作经历加分；具有大型搜索、广告、或者推荐系统的实际研发经验者加分；在人工智能机器学习自然语言处理等领域**会议或者学术期刊发表论文者加分。5、优秀的分析和解决问题的能力，思路清晰，对工作上的挑战充满激情，具有强烈的工作责任感和团队合作精神。工作地址上海-浦东新区-上海市浦东新区申江路5005弄星创科技广场C幢查看地图职位发布者:晓倩HR,趣头条
https://www.lagou.com/jobs/6890942.html?show=4ce1d540f98046efa00d98c30a9b206f,搜索算法,25k-45k,上海,经验3-5年,本科及以上,全职,职位诱惑：五险一金，职业晋升，相关培训，周末双休职位描述：工作职责：基于ElasticSearch的搜索系统研发，构建能稳定运行的搜索集群，扩展现有搜索系统的功能。02职位要求：计算机相关专业本科及以上熟练掌握Java熟练掌握基本数据结构和算法熟知搜索引擎底层原理对自然语言处理和推荐系统有一定了解加分项：熟练掌握CC++，深刻理解Linux以及网络编程原理参与过大型搜索系统的研发对机器学习有一定了解工作地址上海-浦东新区-南码头-尚博创意园东方路3539号2501-2505室(贰号楼3楼)查看地图职位发布者:sophieHRBP,韩创科技
https://www.lagou.com/jobs/6938271.html?show=4ce1d540f98046efa00d98c30a9b206f,搜索算法工程师,25k-50k,深圳,经验3-5年,本科及以上,全职,职位诱惑：自有平台用户量大欧美市场职位描述：工作内容：1、参与搜索引擎的研发工作，负责搜索语义向量召回，term召回，query意图识别，以及召回结果排序模型的建设;2、提升搜索质量负责召回相关性和语义向量的持续优化;3、应用机器学习、NLP等技术处理海量数据，分析和挖掘各种潜在关联，构建电商知识图谱和用户画像。岗位要求：1、优秀的分析问题和解决问题的能力、能够将复杂的业务场景分解、抽象成标准化的业务模型；2、扎实的代码能力、数据结构和基础算法功底，至少熟练掌握PythonJavaCC++Golang等一门编程语言；3、参与过搜索实际项目的开发，有丰富的架构设计、特征工程、画像体系建设等方面经验，熟练掌握基本的召回和排序算法，并对领域前沿算法有研究；4、对技术有热情，有良好的沟通表达能力和团队精神。工作地址深圳-南山区-科技园-科兴科学园查看地图职位发布者:爱美购HRHR,爱美购
https://www.lagou.com/jobs/7051671.html?show=4ce1d540f98046efa00d98c30a9b206f,搜索算法工程师,20k-30k,北京,经验1-3年,本科及以上,全职,"职位诱惑：五险一金、友爱团队、双休、饭补职位描述：职位描述：1、负责搜索服务的开发，为上层服务提供数据和接口支持；2、搜索效果优化；3、富文本(rst,latex)中的字符匹配(例如：数学题目）3、内容抓取等一些其它基础服务研发工作。任职资格：1、必须有可循的搜索和文本匹配相关的工作经验。2、最好对elasticsearch或lucene有开发或运维经验，对全文检索引擎底层原理有一定理解更佳；3、熟悉搜索引擎召回或者排序算法，熟悉NLP相关技术；4、对数据库、缓存、队列、分布式等技术有一定理解；5、拥有良好的代码习惯，遵循公司代码规范和安全规范；6、对搜索引擎有浓厚兴趣，希望深入钻研者优先考虑；7、对大数据相关技术和流式处理等技术与爬虫有一定理解者优先考虑；8、踏实诚恳、责任心强，有良好的沟通能力。工作地址北京-东城区-安定门-雍和宫查看地图职位发布者:EZerHR",EasyGroup
https://www.lagou.com/jobs/7065802.html?show=4ce1d540f98046efa00d98c30a9b206f,搜索算法工程师-ToB,20k-40k,深圳,经验不限,本科及以上,全职,"职位诱惑：六险一金,弹性工作,免费三餐,租房补贴职位描述：职位职责：1、负责ToB业务电商搜索的rank、query分析、相关性计算、推荐等技术方向的深入研究，设计算法方案并调优算法效果；2、负责将算法成果工程化，应用到实际业务场景中，提升用户的搜索体验，以及排序场景的各项业务指标，包括相关性，点击率，转化率，退款率等；3、负责搜索算法、推荐等技术中具体方向的中长期规划和项目落地。职位要求：1、熟练掌握C++PythonShell等编程技能，有扎实的编程基础、良好的编程风格与工作习惯；2、有丰富的算法项目经验，熟悉SparseLR、DFFM、Deep&Wide、DSSM在大规模稀疏数据上的应用及优化；3、熟悉至少一种主流深度学习编程框架(TensorFlowCaffeMXNet)，熟悉常用的深度学习算法；4、具有独立解决问题的能力，良好的团队合作意识和沟通能力；5、对搜索引擎、推荐系统、计算广告相关领域有经验者优先。工作地址深圳-南山区-创业路3023号公园一号办公楼查看地图职位发布者:字节跳动HRHRBP",字节跳动
https://www.lagou.com/jobs/7084647.html?show=4ce1d540f98046efa00d98c30a9b206f,资深搜索算法专家-音乐事业部,50k-80k,杭州,经验5-10年,本科及以上,全职,职位诱惑：空间大职位描述：【职位描述】1、负责云音乐核心场景搜索算法研发，负责搜索算法体系重构升级，优化搜索排序算法，提高搜索的相关性以及整体转化率；2、支撑业务需求快速迭代，参与和负责搜索算法关键技术突破，包括Query理解、召回算法、排序算法等；3、对业务和技术方向有深度洞察，对搜索推荐领域富有极大热情，挖掘搜索潜在的可扩展场景，实现搜索智能化、场景化。【职位要求】1.5年以上机器学习应用经验，有搜索领域丰富的实战经验，有推荐排序优化相关经验。包括召回、在线排序、多样性等，包括分词、索引、意图分析等；2、熟练常用的大数据开发工具，例如hadoopsparkhive；能熟练运用搜索相关性的技术，包括分词、索引、意图分析等；3、优秀的分析能力、解决问题的能力，善于发现，喜欢挑战，有良好的沟通能力。工作地址杭州-滨江区-长河-网易大厦查看地图职位发布者:Michael...招聘经理,网易
https://www.lagou.com/jobs/7109313.html?show=4ce1d540f98046efa00d98c30a9b206f,推荐搜索算法专家,30k-60k,北京,经验不限,学历不限,全职,职位诱惑：核心事业部，发展潜力大职位描述：1、参与和负责支付宝核心场景搜索推荐算法研发，深度Query与用户理解、深度个性化召回排序技术、机制与策略、智能交互、端智能算法等。2、支撑业务需求快速迭代，持续创新突破核心技术，优化平台用户体验和业务价值。3、对业务和技术方向有深度洞察，持续关注前沿进展，对搜索推荐领域富有极大热情。职位描述1.两年以上机器学习应用经验，有搜索、推荐、广告等领域丰富的实战经验，在Query与用户理解、召回排序、机制设计、智能交互、端智能中一个或多个领域有深入实践；2、熟练掌握机器学习算法原理，能熟练运用机器学习、自然语言处理、匹配技术、预估、运筹优化、强化学习、智能生成等技术解决有挑战性的问题，有业界顶会论文发表优先；3、对数据敏感度极高，有良好的逻辑思维和定义以及解决问题的能力4、优秀的组织协调能力，能够整合资源完成有挑战的目标。工作地址北京-朝阳区-东三环中午一号环球金融中心东塔9楼查看地图职位发布者:次次招聘,蚂蚁金服集团
https://www.lagou.com/jobs/7110574.html?show=4ce1d540f98046efa00d98c30a9b206f,视频搜索算法研发工程师,30k-60k,上海,经验不限,学历不限,全职,"职位诱惑：六险一金,弹性工作,免费三餐,租房补贴职位描述：职位职责：1、参与字节跳动搜索引擎研发工作；2、负责西瓜视频、今日头条等产品的搜索算法研发；3、用最前沿的算法，做最激动人心的技术，给用户最好的搜索体验。职位要求：1、出色的分析问题、解决问题能力，总是能从纷繁复杂的数据中一眼看出问题本质；2、扎实的代码能力、数据结构和基础算法功底，能够从容应对超大规模数据和计算中面临的工程挑战；3、熟悉Linux开发环境，熟练使用C++和Python语言；4、有工业级大规模搜索引擎研发经验者加分，有机器学习和NLP基础并能熟练地建模解决业务问题者加分；5、如果你绝顶聪明可以快速掌握以上技能、并有志投身研发最优秀的中文搜索引擎，则没有经验不是问题、加入我们、我们愿意培养你。工作地址上海-闵行区-宜山路1999号科技绿洲三期24号楼查看地图职位发布者:EEmmaWuHRBP",字节跳动
https://www.lagou.com/jobs/7175325.html?show=4ce1d540f98046efa00d98c30a9b206f,搜索算法高级工程师,30k-50k,北京,经验3-5年,学历不限,全职,职位诱惑：医疗独角兽业务广成长空间大挑战性职位描述：职位描述：1.负责好大夫搜索技术研究，包括查询理解、语义相关性、召回索引、转化率预估等核心技术；2.探索个性化搜索中深度学习、强化学习技术，并落地应用；3.探索前沿人工智能技术，并落地个性化搜索业务。职位要求：1.对NLP、图嵌入、语义技术、排序模型有深入的理解和应用经验，有搜索算法经验。2.熟练掌握机器学习、深度学习等方向理论和应用，动手能力强，有主动探索和思考。3.熟练应用算法平台，如TensorFlow、PyTorch等，熟悉Spark、Hive等大数据处理框架优先。工作地址北京-朝阳区-定福庄-北京市朝阳区三间房南里4号院DREAM2049国际文创产业园查看地图职位发布者:潘先生招聘专员,好大夫在线
https://www.lagou.com/jobs/7194687.html?show=4ce1d540f98046efa00d98c30a9b206f,搜索算法工程师,50k-100k,北京,经验不限,本科及以上,全职,职位诱惑：国内互联网医疗领域领头羊职位描述：岗位职责：1.对机器学习前沿技术的理解和应用，落地到移动互联相关业务场景，包括但不限于数据结构算法、传统机器学习、深度学习等技术方向2.针对自然语言处理、搜索引擎排序、用户行为建模、个性化推荐等项目，完成技术选型、数据获取、模型验证与上线开发等工作3.参与核心机器学习算法实现与部署任职要求：1.计算机、信息、数学类等相关专业本科及以上学历；2.熟悉机器学习算法原理和实现，对机器学习深度学习自然语言处理化学习任一子方向有深入研究3.算法基础扎实，熟练掌握cc++javapython编程，有较强的算法实现能力，可以快速将想法实现4.熟练掌握一种以上深度学习框架（CaffeTensorflowTorchMxNetTheano等）工作地址北京-朝阳区-常营-地铁八通线双桥站A口Dream2049产业园东门B05栋查看地图职位发布者:宋双斌好大夫在线,好大夫在线
https://www.lagou.com/jobs/7231695.html?show=4ce1d540f98046efa00d98c30a9b206f,搜索算法,15k-25k,成都,经验3-5年,本科及以上,全职,"职位诱惑：五险一金绩效奖金节日福利带薪年假职位描述：工作职责：1、负责公司行业搜索引擎应用框架平台的开发和维护；2、负责搜索排序质量跟踪、持续优化和性能调优；3、负责为公司关键业务打造高容量、高稳定、高性能和易用的数据搜索基础设施;024、能够理解业务场景，推动搜索引擎平台化落地，通过优化搜索引擎开发接口和平台管理，提升业务开发人员使用搜索引擎的用户体验任职要求：1、优秀的编码与代码控制能力,有扎实的数据结构和算法功底，5年以上相关工作经验；02022、熟悉搜索引擎的架构，具有Lucene、Solr和ElasticSearch等平台开发、优化和维护经验，并能在开源代码基础上进行二次扩展开发；3、熟悉搜索引擎，对相关性优化，query改写，排序模型等搜索相关算法策略有一定了解，至少对其中一项比较精通；4、精通java设计模式，具备实践经验；5、了解微服务架构和实现技术，并使用过SpringBootSpringCloud或Dubbo等框架。6、熟悉酒店业务优先工作地址成都-武侯区-天府大道北段1700号环球中心E3-11606室查看地图职位发布者:四川商旅无忧人事",商旅科技
https://www.lagou.com/jobs/5849851.html?show=b532210fe8aa49ca986ce6a6a4dd52ad,研发经理,18k-25k,上海,经验5-10年,学历不限,全职,职位诱惑：大平台五险一金带薪年假职位描述：工作职责：1.020202020202负责公司技术平台的架构规划和落地；2.020202020202负责编写服务端系统框架和核心代码；3.020202020202负责解决后端系统中的性能瓶颈；4.020202020202负责开发工程师的代码评审，高质量地完成开发任务。任职要求1.0202020202023年以上的Java研发经验，2年以上的架构设计经验；2.020202020202熟练掌握Java相关技术和框架的使用（包括Java基础多线程SpringBootSpringCloudmyBatisDubbo等）；3.020202020202精通分布式系统的设计和应用，精通分布式框架、中间件、数据库等机制，有高并发处理经验；4.020202020202熟悉数据库原理和性能优化；5.020202020202对业务架构和技术架构有自己的深入见解，有saas系统架构经验者优先；6.020202020202强烈的技术热情和工作责任感，具有良好的沟通技能，团队合作能力，追求**的心态。加分项：l02HR系统开发经验l02从0到1产品研发经验l02产品化思维l02敏捷开发经验工作地址上海-浦东新区-东方路1215号陆家嘴软件园8号楼7层查看地图职位发布者:招聘小分队HR,蜻蜓FM
