jobUrl,jobName,jobSalary,jobLocation,jobExperience,jobDegree,jobType,jobDetail,jobCompanyName
https://www.lagou.com/jobs/7233528.html?show=365c9bfb9cb942d68486b9aee5620a35,C++QT开发工程师(J11415),10k-15k,北京,经验1-3年,本科及以上,全职,职位诱惑：节日福利五险一金交通补助带薪年假弹性工作职位描述：工作职责:1.基于QT、C++、OPENGL、VAPOR进行三维显示系统的设计与二次开发。2.参与产品的系统设计、代码编写、文档撰写等工作。3.参与气象产品算法研发。4.参与基于GPU的图像产品制作流程。任职资格:1.本科以上学历，一年以上C++及QT软件开发经验。2.掌握CC++语言，熟练使用STL模板库。3.熟练掌握MYSQL、SQLite等数据库。4.熟悉Liunx下操作，熟悉TCPIP协议。5.熟练使用Cmake、makefile、Qmake进行项目编译。6.熟悉3D图像学原理，具有OPENGL或者OSG开发经验。7.熟练使用shell进行脚本编程。8.有CUDA编程经验优先。工作地址北京-朝阳区-亚运村-北京市朝阳区北辰东路8号院北辰时代大厦查看地图职位发布者:xuxinHR,朗新科技
https://www.lagou.com/jobs/7233799.html?show=365c9bfb9cb942d68486b9aee5620a35,c++开发工程师-运营商BU-合肥,16k-22k,合肥,经验5-10年,本科及以上,全职,职位诱惑：高薪，平台好，弹性工作，福利好职位描述：岗位职责1.承担电话语音交互系统中语音呼叫组件的开发与维护工作，持续进行系统版本迭代和后台开发工作；2.参与项目的需求分析，设计和编码；3.负责对现有平台架构和设计方案的维护和优化，全方位提高后端系统的稳定性和性能。任职要求1.国内外知名院校计算机相关专业本科以上学历，三年以上C++复杂系统设计实现经验；2.精通常用数据结构和算法，深入理解CC++语言和Linux环境；熟练使用多线程等并行计算模型；3.熟悉主流分布式计算框架；4.思路清晰，思维敏捷，乐于钻研，快速的学习能力，良好的英文资料阅读能力；5.具备问题分析的能力，能够针对指定问题分析定位原因并提供解决方案此岗位为科大讯飞集团统一招聘岗位，人员通过简历筛选、笔试、初试、复试、终审等环节后录用。工作地址合肥-高新区-望江西路666号讯飞大厦查看地图职位发布者:kwcheng招聘专员,科大讯飞
https://www.lagou.com/jobs/7234126.html?show=365c9bfb9cb942d68486b9aee5620a35,HR后台负责人（C&B，IIT...,30k-50k,广州,经验5-10年,本科及以上,全职,"职位诱惑：出海企业高速发展管理岗职位描述：工作职责：1，建立和完善公司国内及海外薪酬福利（C&B，Payroll,IIT，GM和RSU）管理流程；2，确保国内和海外员工薪资福利的计算和发放高效、准确、合规；3，建立完备、准确、高效的薪酬福利基础信息和数据管理体系；4，搭建起全球的SSC线上服务平台和线下服务支持。02任职要求：1，本科以上学历，英文流利，可作为工作语言；2，5-8年工作经验，2年以上管理经验；3，熟悉国内劳动相关政策，如熟悉海外劳动政策者优先考虑；4，对个人所得，员工激励股票等有较多经验者优先考虑；5，在海外工作经验或是在500强外企工作经验者，优先考虑。工作地址广州-番禺区-广州市番禺区市桥街兴泰路274号C栋西塔BIGO公司查看地图职位发布者:AriaHRBP",Bigo
https://www.lagou.com/jobs/2291034.html?show=132dfadacef342cca948932afa254904,IT支持,6k-8k,上海,经验1-3年,大专及以上,全职,职位诱惑：五险一金、餐补、员工旅游、年终奖金职位描述：1、公司计算机软硬件的日常维护及管理；公司所有人员计算机系统的备份和恢复；2、电脑周边设备（打印机、扫描仪、传真机、复印机、投影仪等）安装与维护；3、公司监控设备的安装与维护；4、优化网络系统，规划调整设备配置，完成路由器交换机防火墙的配置施工，参与服务器与应用系统的管理，确保系统的稳定可靠运行；5、完成主管领导交办的其它工作。任职要求：021、计算机或IT相关专业，大学专科以上学历；2、熟悉路由器，交换机、防火墙的网络设备的设置与管理；023、工作认真积极主动，有良好的职业意识和执行能力，能承受工作压力，能高质量的按时完成工作任务，具备良好的服务意识；4、有驾照，会开车的优先考虑；5、工作地点为上海金山区；工作地址上海-金山区-山阳镇阳乐路366号6幢查看地图职位发布者:Iit职位发布者,米开罗那
https://www.lagou.com/jobs/5949175.html?show=132dfadacef342cca948932afa254904,IT支持,5k-10k,上海,经验1-3年,大专及以上,全职,职位诱惑：五险一金、餐补房补、出国游、奖金多多职位描述：我们需要你负责公司系统的软件、硬件、网络设备的日常维护，包括PC、打印机、网络交换机路由器、网络监控系统等；负责应用服务器的实施部署与搭建；负责应用服务器的资源调配和系统安全、数据备份；负责应用服务器各项数据的监控，如流量、负载等。我们期待你1年以上IT支持工作经验；有网络、软件、硬件维护经验；掌握交换，路由管理配置，熟悉VLAN、NAT；熟悉VPN搭建与管理；熟悉windowsAD域控管理、WSUS；熟悉linux系统。工作地址上海-徐汇区-龙华-中山南二路440号宝溢丰大厦wework5层。查看地图职位发布者:只二HRHR,只二
https://www.lagou.com/jobs/6230346.html?show=132dfadacef342cca948932afa254904,华南公司-IT支持工程师,6k-8k,广州,经验1-3年,本科及以上,全职,职位诱惑：央企、工作环境好、有食堂职位描述：工作职责:一、OA管理员1、OA系统日常维护工作和流程配置；2、OA系统培训工作；3、企业微信日常管理工作二、技术支持1、负责重大视频会议的会前调试，会中保障，会后收集意见优化。2、负责处理公司日常办公和电脑软件等的故障处理；3、负责公司办公电脑的流程审批，购买，售后处理等。4、接入型网络设备配置、电话跳线，交换机更换等任职资格:【学历】：大学本科学历，计算机、网络等相关专业；【经验】：有helpdesk经验者优先；【知识】：1、熟悉日常办公设备和电脑软件的故障检测及排除；2、熟悉主流操作系统，了解常见办公软件和外设的安装、配置、排障等；3、掌握计算机网络相关基础知识，熟悉华为、H3C交换机等的简单设置，如VLAN、ACL，静态路由等；【素质】：1、对工作有较强的责任感；2、具备良好的沟通能力；3、具备良好的团队协作能力；4、具备较强的学习能力强；5、适应能力好，有激情，自我要求高。工作地址广州-黄埔区-大沙-海员路97号外运大楼查看地图职位发布者:刘女士员工发展经理,中国外运
https://www.lagou.com/jobs/6287459.html?show=132dfadacef342cca948932afa254904,售后技术支持IT支持实习生,2k-4k,广州,经验应届毕业生,学历不限,实习,"职位诱惑：外资企业，福利优厚，五险一金，员工持股职位描述：Skillset:(pleasefocusonmainskills)*BasicMicroSoftskilllikeWord,Excelandsoon.*02Goodcommunicationskill02willbehighlyneeded.*02Confidentwithboth02EnglishandCantonese02communication.*02Excellentproblem-solving,interpersonalandanalyticalskills.*02Self-motivated,enthusiasticandrapidlearningability.0202020202020202020202020202020202020202-Jobdescription:02020202*02BeresponsibletoAIAHKVitalityBAUsupport,includesT3support,tohelpresolvetheissueswhicharereportedbyVitalitymembers*02AuditsupportwhichfocusonthemedicalchecksofVitalitymembers工作地址广州-天河区-东宝大厦24楼查看地图职位发布者:LauraSpecialist",友邦科技
https://www.lagou.com/jobs/6707091.html?show=132dfadacef342cca948932afa254904,IT支持(C010157),8k-14k,上海,经验1-3年,大专及以上,全职,职位诱惑：福利待遇佳，发展好职位描述：岗位职责：1、负责办公区的IT桌面支持工作，为办公区提供强有力的IT支持；2、负责办公区打印机、投影仪、门禁考勤等IT设备的管理和日常维护；3、负责其他IT事项，如资产管理、会议系统等；4、充分了解熟悉产品及用户环境，能利用已有的解决方案快速解决用户问题。任职要求：1、做事认真，脚踏实地，责任心强，有上进心，无不良嗜好；2、服务意识好，能实时跟进问题处理进度；3、热爱学习，熟悉计算机软硬件维护；4、具备1年以上IT相关工作经验，熟悉计算机网络和Linux操作系统者优先；5、有互联网行业背景者优先02。工作地址上海-长宁区-娄山关路533号金虹桥国际中心查看地图职位发布者:拼多多HR,拼多多
https://www.lagou.com/jobs/6247131.html?show=1c768a816bbb430a83bc76107283670a,推荐算法工程师,20k-30k,深圳,经验3-5年,本科及以上,全职,"职位诱惑：年底双薪,季度奖,氛围好,稳定平台职位描述：1、人工智能、机器学习等领域开展前沿技术研究，并应用于业务领域研发；2、参与和推动技术落地到项目应用上；3、跟踪人工智能技术进展，研究人工智能算法，探索人工智能在业务方向上的价值点；任职要求：1、本科及以上学历，计算机、软件工程、网络工程、自动化、数学等相关专业优先；2、有大数据、机器学习、图像识别、广告推荐中至少一种相关背景和经验，有机器学习应用于广告推荐的经验优先；3、至少熟练使用一款开源机器学习工具；4、算法与编程能力强、熟悉机器学习常用算法：决策树，随机森林，协同过滤，SVM，回归算法等；5、思维严密，态度积极，有良好的团队意识和协作精神。机会吸引点：1、因为股东背景，背靠OPPO和vivo两大渠道资源，目前团队产品累计下载量超4.6个亿，用户规模巨大；2、做事空间大，有机会利用海量用户资源做出最佳的游戏AI实践；3、公司平台靠谱，11年老厂，研发、发行、资金实力都很棒。工作地址深圳-南山区-科技园-科技园高新南一道赋安科技大厦B座6楼查看地图职位发布者:尚游游戏HR",尚游游戏
https://www.lagou.com/jobs/6304987.html?show=1c768a816bbb430a83bc76107283670a,AI算法专家,30k-60k,深圳,经验5-10年,硕士及以上,全职,职位诱惑：平台稳定，年终奖丰厚，团队优秀，氛围活跃职位描述：1、02人工智能、机器学习等领域开展前沿技术研究，并应用于业务领域研发；2、02参与和推动技术落地到项目应用上；3、02跟踪人工智能技术进展，研究人工智能算法，探索人工智能在业务方向上的价值点；02任职要求：1、02硕士及以上学历，计算机、软件工程、网络工程、自动化、数学等相关专业优先，4年以上工作经验；2、02有大数据、机器学习、图像识别、广告推荐中至少一种相关背景和经验，有机器学习应用于广告推荐的经验优先；3、02至少熟练使用一款开源机器学习工具；4、02算法与编程能力强、熟悉机器学习常用算法：决策树，随机森林，协同过滤，SVM，回归算法等；5、02思维严密，态度积极，有良好的团队意识和协作精神。机会吸引点：1、因为股东背景，背靠OPPO和vivo两大渠道资源，目前团队产品累计下载量超4.6个亿，用户规模巨大；2、做事空间大，有机会利用海量用户资源做出最佳的游戏AI实践；3、公司平台靠谱，11年老厂，研发、发行、资金实力都很棒。工作地址深圳-南山区-科技园-科技园高新南一道赋安科技大厦B座6楼查看地图职位发布者:尚游游戏HR,尚游游戏
https://www.lagou.com/jobs/7231818.html?show=1c768a816bbb430a83bc76107283670a,推荐算法工程师专家,30k-60k,北京,经验5-10年,本科及以上,全职,职位诱惑：七险一金，团队氛围，晋升空间，大牛带队职位描述：职位描述深入理解业务和机器学习技术，优化模型，推荐策略，持续提升推荐效果；02负责直播短视频个性化推荐检索召回策略以及排序算法设计与研发；职位要求研究生及以上学历，计算机、数学相关专业，3年以上个性化推荐算法工作经验；熟悉EmbeddingFMDNN等算法模型原理，并且有实际工程实践经验；熟练使用c++pythonjava其中一种语言，有扎实的编程基础和工程实践；善于思考和学习，对算法落地有充分的理解，对有挑战性的问题充满激情，具有良好的团队合作精神和较强的沟通能力以及抗压能力；有ACM或类似算法竞赛经历者优先。工作地址北京-朝阳区-百子湾-惠通时代广场查看地图职位发布者:SunnyHRM,乐我无限
https://www.lagou.com/jobs/7232152.html?show=0fa77ec1d1bd4a17a5419ab0919a58de,架构师,20k-30k,上海,经验5-10年,本科及以上,全职,"职位诱惑：与技术大牛同办公弹性上班避开高峰职位描述：素质要求:流利的英文表达能力,能够培训客户集成和使用蚂蚁安全平台.较强的学习和分析能力,对于未知的客户环境,能够快速介入并完成摸底,对于客户系统与蚂蚁安全系统的集成能够形成可落地方案,并能够指导外部(JV)和内部(ISV,如有)完成相关开发工作.熟练掌握SpringBoot相关框架,如熟悉蚂蚁技术栈(如SOFABoot,SOFA4)更佳.有5年以上商业项目开发和集成经验，可以指导客户集成开发工作工作职责：任集成讲师，对客户进行赋能，赋能内容包括风控相关集成，定制化开发，测试（含设备指纹，RDS，风控，核身）；客户项目实际集成期间提供指导，解决方案对客户集成过程中的问题进行回答，指导工作地址上海-浦东新区-洋泾-蚂蚁S空间查看地图职位发布者:张仕凤招聘专家",法本信息
https://www.lagou.com/jobs/7233228.html?show=0fa77ec1d1bd4a17a5419ab0919a58de,架构师,25k-35k,上海,经验5-10年,大专及以上,全职,职位诱惑：新增岗位职位描述：1、主导各类业务及技术改造类项目的系统分析与设计工作，承担核心功能代码编写，开发与维护系统公用核心模块；022、系统性能优化，主导技术难题攻关，持续提升系统处理性能，解决各类潜在系统技术风险，保证系统的安全、稳定、快速运行；023、负责指导、培训普通开发工程师，审核开发工程师的设计与研发质量；岗位要求：1、扎实的java编程基础，精通JavaEE、SOA等相关技术；对各种开源的框架如Spring、ibatis等有深入的了解，对框架本身有过开发或重构者可优先考虑；022、三年以上数据库如MySQL使用经验，2年以上大规模高并发访问的Web应用系统设计和开发经验；023、熟练掌握unixlinux操作系统，对常用命令运用娴熟，能够根据实际需要快速编写shell脚本；024、具备良好的识别和设计通用框架及模块的能力；025、较强的表达和沟通能力；工作认真、严谨、敬业，对系统质量有近乎苛刻的要求意识；026、具有大型电子商务网站以及银行业核心系统设计与研发经验背景的优先考虑；027、base地：上海工作地址上海-长宁区-周家桥-德必易园c栋6楼查看地图职位发布者:曹鑫人事行政助理,南瓜车
https://www.lagou.com/jobs/7233517.html?show=1c768a816bbb430a83bc76107283670a,资深算法工程师专家（北京）,30k-50k,北京,经验3-5年,本科及以上,全职,职位诱惑：全球出国游；福利完善；发展空间大职位描述：岗位职责：1、算法创新：基于平台业务现状定位算法的增长抓手，主动协调资源，驱动业务发展；2、模型优化：引入业界最新模型，提升大规模稀疏模型的预估精准度；3、机制设计：运用运筹优化相关算法，改善竞价机制。提升平台收益；4、投放工具：让广告投放、物料选择自动化、智能化。解放人力，提升广告主投放效果；5、数据利用：底层数据画像建设的完善与利用。岗位要求：1、基本要求：计算机或相关专业硕士以上学历，有过搜索、广告、推荐算法经验者者优先；2、算法能力：有深度学习和增强学习、运筹优化等技术深度实战经验者加分；3、业务能力：基于平台业务现状定位增长抓手，主动协调资源，驱动业务发展；4、熟悉RTB广告者加分，能够定义当前优化目标，平衡各方利益；5、工程能力：大数据平台开发能力；工程系统能力强加分；6、有头部广告公司的从业经历加分（凤巢\百度网盟、阿里妈妈、广点通、穿山甲等）。我们的优势：1、和优秀的伙伴一起成长：全员硕士及以上学历，核心成员来自阿里、网易。a)模型先进：ctr预估ocpc活动优选素材优选。模型采用onlinefmffm+essmdeepFMFNN等等；框架基于spark+tensorflow。自研参数服务器和大规模稀疏特征端到端解决方案。技术的广度和深度不断拓展。b)技术驱动业务：广告智能托管(人机结合+智能出价+智能定向)，投放建议、预算平滑。技术和业务完美结合。2、工作方式开放透明：没有界限，你的好想法必将实现。定制化个人成长，成长是最大的kpi3、公司飞速发展：互动效果广告领域的开创者，SAAS运营领域的领导者工作地址北京-朝阳区-朝外-朝阳门外大街乙12号院1号昆泰国际大厦2308查看地图职位发布者:夏真HRBP,兑吧
https://www.lagou.com/jobs/7233674.html?show=0fa77ec1d1bd4a17a5419ab0919a58de,架构师,17k-25k,成都,经验5-10年,本科及以上,全职,职位诱惑：周末双休带薪年假职位描述：岗位职责：1、主导系统架构持续优化，为团队指引技术发展方向，优化团队研发流程和方法，不断提高团队代码质量、研发水平和工作效率；2、协助项目经理、业务开发工程师根据项目的需求制定合理的技术方案并进行具体实施；3、对业务系统开发团队遇到的技术难点进行攻关，提供日常技术支持服务，以保证业务系统开发的顺利进行。4、独自或带领团队完成基础类库及工具、中间件、技术支持平台的研发；岗位要求：1、5年以上基于JAVA平台的BS架构开发经验；2、本科学历及以上，计算机相关专业，具备扎实的计算机理论基础，至少有3年以上中大型产品、软件项目实际架构设计经验，有团队管理经验者优先；3、熟悉基于springCloud的微服务架构设计4、熟悉常用开源框架及设计模式(如：MVC框架、消息中间件、连接池、系统监控等)，并具有主导其中一种或以上的成功开发经验；5、熟悉多线程、多进程、异步IO等并发开发模型，掌握其中一种或多种模型下的通讯和同步技术，并有实际的开发经验。6、熟悉常用数据库：如Oracle、MySQL、MongoDB、Redis等，并具有较好的SQL优化知识；7、具备较大规模的分布式系统设计研发经验，熟练掌握Spring、SpringBoot、Mybatis、SpringCloud等框架，并深入理解其原理；8、对常用的中间件(RabbitMQ、Kafka、Zookeeper等)有深入理解；9、了解云计算及大数据相关技术，如Hadoop、HBase、Storm、Spark、Docker等；10、熟悉使用阿里云的常用产品如ECS、SLB、CSB、GTS、EDAS等11、具备较强的文档能力，能够编写相关的设计文档；12、思维敏捷，性格开朗，责任感强，工作积极主动，有良好的团队协作意识，易于沟通。工作地址成都-高新区-天府大道北段1480号拉德方斯大厦东楼七楼查看地图职位发布者:HhuianrongHR经理,汇安融
https://www.lagou.com/jobs/7233688.html?show=0fa77ec1d1bd4a17a5419ab0919a58de,系统架构师,15k-25k,上海,经验5-10年,硕士及以上,全职,职位诱惑：行业前景好，职业发展广阔，大牛带队职位描述：1.深入理解业务需求，负责设计和规划业务系统平台架构；2.主导技术方案和系统设计，把握复杂系统的设计，有能力解决性能、网络、分布式等引起的一系列技术问题；3.主导业务、技术改造类项目的设计、分析和设计工作，承担核心功能、公共核心模块的代码编写；4.指导和培训技术人员，提升团队的技术分析、设计能力和系统架构能力。岗位要求：1.计算机或者相关专业本科以上学历，5年以上开发经验，2年以上的技术架构设计经验，2.拥有多层架构软件系统的设计和实施经验，精通主流web开发框架，熟悉SOA、微服务体系；3.熟悉常见的开源框架及产品：SpringCloud、SpringCloudAlibaba、SpringData、MyBatis、Redis、MangoDB、MQ等4.对于高并发高吞吐系统的设计模式和性能优化有丰富的经验。5.熟悉软件工程理论、有较强的系统分析能力，精通设计模式和软件架构；6.熟悉各类服务端规划、部署、治理，熟悉Tomcat、Nginx、Docker、K8S等；7.熟悉常用数据库，包括RDBMS和NoSQL；熟悉Linux操作系统；8.工作积极主动，有解决问题的思路，良好的沟通能力，有一定抗压能力。工作地址上海-黄浦区-城隍庙-上海市黄浦区江西中路115号2楼查看地图职位发布者:刘芳人事总监,铂略金融
https://www.lagou.com/jobs/7233889.html?show=0fa77ec1d1bd4a17a5419ab0919a58de,系统架构师,18k-33k,深圳,经验5-10年,本科及以上,全职,职位诱惑：双休；五险一金；年终奖金；团队氛围好职位描述：1、致力于构建人事管理领域SaaS服务，负责业务微服务系统的架构设计、技术设计评审、编写关键服务以及核心代码；2、执行及优化现有系统微服务架构，领导团队梳理并攻关数据隔离、系统解耦、领域驱动开发等课题的技术难关；3、参与制定代码规范、测试规范，建设研发线研发文化，建立卓越的工程效率质量体系；4、参与规划技术方案建设和技术储备，建立行业领先水平的核心技术能力任职要求1、统招本科及以上学历，5+年工作经验；2、熟悉多种编程语言，如Java、Golang、Python等；3、具备优秀的架构思想，能够分析出问题的本质和关键点，从长远发展上给出最优解；4、基础知识扎实，喜欢技术研究，追寻技术框架的实现原理，对主流开发技术有自己独到的解读；5、拥有和工作年限相称的技术广度或深度，有较强的逻辑思维能力，善于分析、归纳、描述、沟通和解决问题；6、高度的创业心和投入度，既可以技术难题，且关注业务，用技术力贡献于业务成功；工作地址深圳-南山区-前海-高新中三道9号环球数码大厦A座1501室查看地图职位发布者:王晓宇技术总监,易博天下
https://www.lagou.com/jobs/3993672.html?show=e90dec520838423bba64f40750331f84,前端工程师,10k-15k,苏州,经验3-5年,本科及以上,全职,职位诱惑：领导nice，地铁口，上升空间职位描述：岗位职责1、负责客户端的基础架构及开发架构的研究、设计和实现；2、根据产品需求，进行移动产品功能模块开发和调试优化；3、与后端人员进行沟通，协同解决及优化前后端数据交互，提高用户体验。任职要求1、3年以上前端工作经验，；2、熟悉ajax原理，理解http协议，对H5、JS、CSS有深刻的认识；3、掌握react、vue或者angular中的一个或多个，对算法、数据结构以及后台开发有一定的了解。工作地址苏州-工业园区-湖东-巨中银座19楼查看地图职位发布者:付洁人事主管,中地行
https://www.lagou.com/jobs/4117718.html?show=66465ef885f440f1a738275d6beb3e05,区块链记者,7k-14k,北京,经验不限,本科及以上,全职,"职位诱惑：核心团队,积累资源,发展前景好,期权分红职位描述：职位描述021、深入挖掘区块链领域相关信息及政策并进行分析报道；2、对区块链领域的创始人、行业专家和投资人进行访谈报道。02任职要求1.02对商业世界有浓厚兴趣，好奇心，愿意研究问题，把事情弄清楚，有逻辑，条理清晰；2.英语水平良好，有浏览海外科技资讯、社交媒体的习惯；3.全日制本科及以上学历，财务、金融、经济、中文、新闻相关专业，有较好的书写能力与新闻敏感性；4.有海外留学经历优先。工作地址北京-东城区-东四-宇飞大厦五层查看地图职位发布者:潘宇波联合创始人",捕手志
